conversation_id_str,created_at,favorite_count,full_text,id_str,image_url,in_reply_to_screen_name,lang,location,quote_count,reply_count,retweet_count,tweet_url,user_id_str,username,Prediksi_Naive_Bayes,Probabilitas_NB,Prediksi_Logistic_Regression,Probabilitas_LR
1829501562953273738,Fri Aug 30 12:48:57 +0000 2024,0,Jumat Curhat Sebagai Media Cooling System Jelang Pilkada Serentak 2024 Menjelang Pilkada serentak baik Pemilihan Umum Gubernur dan Wakil Gubernur Jatim maupun Pemilihan Bupati dan Wakil Bupati Trenggalek dinamika sosial dan politik. Selengkapnya https://t.co/p7wmfR3G7u https://t.co/qHENQ2Bvce,1829501562953273738,https://pbs.twimg.com/media/GWOx9uzbsAABFzp.jpg,,in,,0,0,0,https://x.com/PolsekK23332/status/1829501562953273738,1736701235426893824,PolsekK23332,positif,76.27%,positif,55.32%
1829498491334213865,Fri Aug 30 12:36:48 +0000 2024,5,Komitmen Masyarakat Jatim Wujudkan Pilkada 2024 Aman dan Damai. #Pilkada2024 #Pilkada2024kondusif #Pilkada2024AmanDamai #PilkadaSerentak2024 #SATUsemangatNKRImaju https://t.co/Z8FdZZKQdG,1829498502734336061,https://pbs.twimg.com/media/GWOvMQpboAAnDsk.jpg,Iren___E,in,,0,1,0,https://x.com/Iren___E/status/1829498502734336061,1356609082430394368,Iren___E,positif,61.22%,positif,48.99%
1829497419194663168,Fri Aug 30 12:32:29 +0000 2024,0,Usai Resmi Daftar Pilkada Jatim 2024 Risma Disebut Belum Serahkan Surat Pengunduruan Diri sebagai Mensos #Risma #batampos https://t.co/wUlO2JMpDD,1829497419194663168,,,in,"Orchad Walk Blok H-1, Batam",0,0,0,https://x.com/BatamPos/status/1829497419194663168,60490875,BatamPos,negatif,74.42%,negatif,48.53%
1829490647516299619,Fri Aug 30 12:05:35 +0000 2024,0,KPU Jatim Resmi dan Sah Nyatakan Ada Tiga Paslon Peserta Pilgub pada Pilkada 2024 #BNetwork https://t.co/11pA1n3ZlT,1829490647516299619,,,in,Jakarta,0,0,0,https://x.com/Beritasatu/status/1829490647516299619,154102750,Beritasatu,positif,62.28%,positif,51.93%
1829472695584424444,Fri Aug 30 10:54:15 +0000 2024,0,Profil Ganis Rumpoko Anak Eks Wali Kota Batu yang Maju Pilkada 2024 https://t.co/JNP849iKWs,1829472695584424444,,,in,"Jawa Timur, Indonesia",0,0,1,https://x.com/IDNTimesJatim/status/1829472695584424444,1318893514336264193,IDNTimesJatim,negatif,79.14%,negatif,48.91%
1829463576253263942,Fri Aug 30 10:18:01 +0000 2024,0,Tuntaskan Tes Kesehatan di RSUD dr Soetomo untuk Syarat Pilkada Jatim 2024 Khofifah: Bismillah Hasilnya Semua Baik https://t.co/GdEC5WQgpf,1829463576253263942,,,in,Jakarta,0,0,0,https://x.com/jawapos/status/1829463576253263942,2392460208,jawapos,positif,66.92%,positif,53.63%
1829453759040393655,Fri Aug 30 09:39:00 +0000 2024,0,Koordinator Staf Khusus Presiden Ari Dwipayana Sebut Risma Belum Serahkan Surat Pengunduruan Diri sebagI Mensos usai Resmi Daftar Pilkada Jatim 2024 https://t.co/Bghn6JoixL,1829453759040393655,,,in,Jakarta,0,1,0,https://x.com/jawapos/status/1829453759040393655,2392460208,jawapos,negatif,57.52%,netral,36.42%
1829445278971429195,Fri Aug 30 09:05:18 +0000 2024,6,Jumat Curhat Sebagai Media Cooling System Jelang Pilkada Serentak 2024 Menjelang Pilkada serentak baik Pemilihan Umum Gubernur dan Wakil Gubernur Jatim maupun Pemilihan Bupati dan Wakil Bupati Trenggalek dinamika sosial dan politik masyarakat terus berkembang. Lawan Hoaks https://t.co/Q8A4naJoR9,1829445278971429195,https://pbs.twimg.com/media/GWN-yU0aUAAeDwM.jpg,,in,"Trenggalek, Jatim, Indonesia",0,1,1,https://x.com/1trenggalek/status/1829445278971429195,823858795021410304,1trenggalek,positif,66.40%,positif,53.08%
1829443610934120460,Fri Aug 30 08:58:40 +0000 2024,0,Gagal Maju di Pilkada 2024 Anies Baswedan: Allah Pasti Berikan yang Terbaik - https://t.co/b96li69Er9,1829443610934120460,,,in,"Ponorogo, Indonesia",0,0,0,https://x.com/Ponorogo_Berkah/status/1829443610934120460,959859070575394816,Ponorogo_Berkah,positif,47.32%,positif,39.19%
1829443558170095805,Fri Aug 30 08:58:28 +0000 2024,0,Tak Jadi Maju di Pilkada 2024 Anies Baswedan Bakal Lakukan Apa? Dia Bilang Begini - https://t.co/H3FgmlZ3n3,1829443558170095805,,,in,"Ponorogo, Indonesia",0,0,0,https://x.com/Ponorogo_Berkah/status/1829443558170095805,959859070575394816,Ponorogo_Berkah,positif,44.13%,netral,41.25%
1829429751553184017,Fri Aug 30 08:03:36 +0000 2024,1,Profil Luluk Nur Hamidah Politisi Perempuan Lawan Risma dan Khofifah di Pilkada Jatim 2024 https://t.co/u2KnqCVoKJ #TempoNasional,1829429751553184017,,,in,Indonesia,0,0,0,https://x.com/tempodotco/status/1829429751553184017,18129942,tempodotco,negatif,84.03%,negatif,63.24%
1829429004778221879,Fri Aug 30 08:00:38 +0000 2024,15,Lima Daerah di Jatim Tercatat Paslon Tunggal untuk Pilkada 2024 https://t.co/nIZF889mKu,1829429004778221879,,,in,"Kota Surabaya, Jawa Timur",4,6,3,https://x.com/e100ss/status/1829429004778221879,848614550,e100ss,negatif,56.18%,negatif,43.87%
1829428232929886502,Fri Aug 30 07:57:34 +0000 2024,1,Pilkada 2024 Polres Ponorogo Gencar Patroli Dunia Maya. Selama tahapan Pemilihan Kepala Daerah (Pilkada) Ponorogo tahun 2024 Polres Ponorogo bakal gencar melakukan cyber patrol atau patroli dunia https://t.co/AG0J89q23d #HukumKriminal #Jatim #Ponorogo via @beritajatimcom,1829428232929886502,,,in,Surabaya,0,0,0,https://x.com/beritajatimcom/status/1829428232929886502,21287066,beritajatimcom,negatif,61.90%,negatif,52.21%
1829360149649338780,Fri Aug 30 07:54:30 +0000 2024,2,@ch_chotimah2 Di jakarta pdip nanti kalah Di jabar juga kalah Di jatim juga kalah Di jateng 50: 50 Di sumut kalah Habis ini pdip di pilkada 2024,1829427462658535776,,ch_chotimah2,in,,0,9,0,https://x.com/jatmiko87355312/status/1829427462658535776,1126802021476999169,jatmiko87355312,negatif,81.03%,negatif,59.73%
1829424185598226680,Fri Aug 30 07:41:29 +0000 2024,0,Pilkada Jawa Timur 2024 mulai memanas. Tiga Srikandi akan bertarung memperebutkan kursi Gubernur Jatim. KPJ Selengkapnya: https://t.co/1UeFjWBwBG #iNews #Pilkada2024 #JawaTimur #Srikandi #Cagub #Gubernur https://t.co/mvU4saj6xa,1829424185598226680,https://pbs.twimg.com/media/GWNreqGXUAEjx4B.jpg,,in,iNews Tower,0,0,0,https://x.com/officialinews_/status/1829424185598226680,132078023,officialinews_,negatif,71.42%,negatif,42.00%
1829422351379009541,Fri Aug 30 07:34:12 +0000 2024,0,Mantan Gubernur Jakarta Anies Baswedan meminta kepada seluruh pendukungnya yang semula berharap dia maju di Pilkada 2024 untuk tetap menghormati satu sama lain dan menjaga suasana teduh. https://t.co/QQOnwkLcdt,1829422351379009541,,,in,Jawa Timur,0,0,0,https://x.com/ANTARAJatim_/status/1829422351379009541,1557190679553769473,ANTARAJatim_,positif,62.24%,positif,57.30%
1829418588811477247,Fri Aug 30 07:19:15 +0000 2024,0,Tiga Srikandi Maju di Pilgub Jatim 2024 Tiga pasangan kandidat bakal calon gubernur-wakil gubernur pada Pemilihan Kepala Daerah (Pilkada) Jawa Timur (Jatim) 2024 telah mendaftar ke Komisi Pemilihan Umum (KPU). Ketiga pasangan tersebut adalah Khofifah Indar Parawansa-Emil https://t.co/BvrsJpkuk8,1829418588811477247,https://pbs.twimg.com/ext_tw_video_thumb/1829418429629227008/pu/img/bpcujJhDQJderW2W.jpg,,in,"Jakarta, Indonesia",0,0,0,https://x.com/Bisniscom/status/1829418588811477247,118646322,Bisniscom,positif,51.95%,positif,41.81%
1829413260665184411,Fri Aug 30 06:58:04 +0000 2024,0,Komisi A DPRD Jatim Apresiasi Kesiapsiagaan Polresta Malang Kota Laksanakan Pengamanan Pilkada 2024 https://t.co/wBntRnIJ5K,1829413260665184411,,,in,"Tuban, Jawa Timur",0,0,0,https://x.com/sibernkri/status/1829413260665184411,1695172854013382659,sibernkri,negatif,83.94%,negatif,65.44%
1829318034462486868,Fri Aug 30 00:39:41 +0000 2024,0,Tiga Srikandi Bertarung Di Pilkada Jatim 2024 https://t.co/Z0vJBfjOBu #TangkapMulyono,1829318034462486868,,,in,Jakarta,0,0,0,https://x.com/Urpin168/status/1829318034462486868,1521679786598604801,Urpin168,negatif,62.68%,negatif,39.55%
1829310458370867212,Fri Aug 30 00:09:34 +0000 2024,0,KPU Pastikan Hanya Ada 2 Paslon yang Daftar Pilkada Ponorogo 2024. Hingga pukul 23.59 WIB hari terakhir pendaftaran tidak ada lagi pasangan calon (paslon) bupati dan wakil bupati yang https://t.co/s0ZDEk0nzA #PolitikPemerintahan #Jatim #Ponorogo via @beritajatimcom,1829310458370867212,,,in,Surabaya,0,0,0,https://x.com/beritajatimcom/status/1829310458370867212,21287066,beritajatimcom,negatif,56.69%,negatif,39.73%
1829296914757812696,Thu Aug 29 23:15:45 +0000 2024,9,Pilkada 2024 sgt istimewa bagi PKB @DPP_PKB krn di beberapa wilayah mengusung kader sendiri. Di Jabar dan Jatim tanpa berkoalisi dgn partai lain PKB maju dgn kekuatan penuh. Saatnya menguji mesin partai scr mandiri. @cakimiNOW @EmHasanuddin @halimiskandarnu @SyaifulHooda,1829296914757812696,,,in,"Jakarta Selatan, DKI Jakarta",0,1,2,https://x.com/idhamarsyadNow/status/1829296914757812696,760368651471990784,idhamarsyadNow,negatif,80.93%,negatif,54.92%
1829165894582648874,Thu Aug 29 14:35:08 +0000 2024,0,Tri Rismaharini dan Zahrul Azhar Asumta atau Gus Hans resmi mendaftar ke KPUD Jawa Timur (Jatim) sebagai calon gubernur dan calon wakil gubernur Jatim 2024. Sebelum itu Tri Rismaharini mengaku tidak mengenal Gus Hans. #pilgub #jatim #trirismaharini #gushans #pilkada #jawatimur https://t.co/UlzqhZwcws,1829165894582648874,https://pbs.twimg.com/ext_tw_video_thumb/1829165747949441024/pu/img/uPvMR2nkIO9E3HFA.jpg,,in,Jakarta,0,0,0,https://x.com/ntvnewsid/status/1829165894582648874,1758030653344657408,ntvnewsid,negatif,51.82%,positif,51.33%
1829162358159384756,Thu Aug 29 14:21:05 +0000 2024,0,Pasangan bakal calon Gubernur dan Wakil Gubernur Jawa Timur (Jatim) Khofifah-Emil punya lawan Risma-Gus Hans di Pilkada 2024. https://t.co/w6rJ20r7LG #RismaGusHans #TriRismaharini,1829162358159384756,,,in,Surabaya,0,0,0,https://x.com/ngopibareng_id/status/1829162358159384756,1291246080269545472,ngopibareng_id,negatif,59.84%,positif,37.10%
1829154590299959793,Thu Aug 29 13:50:13 +0000 2024,0,Tri Rismaharini Mundur Sebagai Mensos Pilih Fokus Maju Pilkada Jatim 2024 #Pilkada2024 https://t.co/mbEq7oUj8L,1829154590299959793,,,in,Jakarta,0,0,0,https://x.com/Kilat_com/status/1829154590299959793,174631261,Kilat_com,negatif,62.37%,netral,33.86%
1829151651527311848,Thu Aug 29 13:38:32 +0000 2024,1,Pemilihan Kepala Daerah (Pilkada) Jawa Timur (Jatim) 2024 mulai memanas. Tiga kandidat akan bertarung memperebutkan kursi gubernur dan wakil gubernur. ~N #PilkadaJatim #Pilkada2024 https://t.co/U0Rff74CpW,1829151651527311848,,,in,Jakarta,0,1,0,https://x.com/kompascom/status/1829151651527311848,23343960,kompascom,negatif,57.70%,negatif,40.52%
1829150453088858465,Thu Aug 29 13:33:46 +0000 2024,1,Kasubbid Sunluhkum Bidkum Polda Jatim Buka Kegiatan Bimtek Fungsi Hukum Polda Jatim TA 2024 dengan Tema Peningkatan Kemampuan Personil Fungsi Hukum yang Berkompetensi dan Profesional guna mendukung Pengamanan Pilkada Serentak dalam rangka menuju Indonesia Maju . https://t.co/NUaZoKGxXL,1829150453088858465,https://pbs.twimg.com/ext_tw_video_thumb/1829150383815700486/pu/img/EfEH1Z7YNLHA5u6I.jpg,,in,,0,0,0,https://x.com/bidhumas_jatim/status/1829150453088858465,1444824442954137603,bidhumas_jatim,positif,71.54%,positif,55.36%
1829148496404066800,Thu Aug 29 13:26:00 +0000 2024,0,[BREAKING NEWS] Pasangan Risma-Gus Han Daftar Pilkada Jatim | Kamis 29 Agustus 2024 https://t.co/o1g6hozPTy,1829148496404066800,,,in,iNews Tower,0,0,0,https://x.com/officialinews_/status/1829148496404066800,132078023,officialinews_,negatif,56.85%,negatif,39.80%
1829147688866332829,Thu Aug 29 13:22:47 +0000 2024,0,KPU Jatim: Pendaftaran Pilkada 2024 Sudah Capai 35 Bakal Calon https://t.co/4NHp6XxrYo,1829147688866332829,,,in,"Bekasi, Jawa Barat",0,0,0,https://x.com/MediaNawacita/status/1829147688866332829,1297798716133236736,MediaNawacita,positif,51.38%,positif,50.26%
1829147504241455188,Thu Aug 29 13:22:03 +0000 2024,0,Buka Posko Pengaduan MAKI Jatim Pantau Ketat Netralitas ASN dan BAZNAS di Pilkada 2024 https://t.co/0xhPAq0tHz,1829147504241455188,,,in,"Bekasi, Jawa Barat",0,0,0,https://x.com/MediaNawacita/status/1829147504241455188,1297798716133236736,MediaNawacita,negatif,65.05%,negatif,54.81%
1829135635418124489,Thu Aug 29 12:34:53 +0000 2024,1,DPP PDIP resmi mengusung Tri Rismaharini dan KH Zahrul Azhar Asumta atau Gus Hans sebagai pasangan bakal cagub-cawagub pada perhelatan Pilkada 2024 Jawa Timur. Ketua DPP PDIP Said Abdullah menjelaskan pasangan Risma-Gus Han mewakili corak kultural di Jatim sebagai representasi https://t.co/wQFk3hAjak,1829135635418124489,https://pbs.twimg.com/media/GWJlImqWkAAWO-9.jpg,,in,"Pulo Gadung, Indonesia",0,0,0,https://x.com/tvOneNews/status/1829135635418124489,55507370,tvOneNews,negatif,74.75%,negatif,49.25%
1829134347313786968,Thu Aug 29 12:29:46 +0000 2024,21,Ditunjuk oleh PDI Perjuangan jadi bakal calon gubernur Jawa Timur dan maju dalam pilkada Jatim 2024 bagi Tri Rismaharini itu merupakan tugas berat karena ia bertanggung jawab atas nasib 41 juta orang di Jawa Timur. #pilgubjawatimur #pilkadajawatimur #trirismaharini https://t.co/wXPKniZgYt,1829134347313786968,https://pbs.twimg.com/ext_tw_video_thumb/1829134202878734336/pu/img/yoEQIp0b6ZtczJAJ.jpg,,in,,1,2,3,https://x.com/Metro_TV/status/1829134347313786968,57261519,Metro_TV,negatif,57.83%,positif,46.10%
1829106994554515899,Thu Aug 29 10:41:30 +0000 2024,3,KPU Jatim pun menegaskan sejauh ini tahapan Pilkada di Jatim telah berjalan sebagaimana mestinya. Teman Pemilih agar tidak ketinggalan perkembangan tahapan Pilgub Jatim 2024 yuk pantau terus website dan media sosial resmi kami. Jangan lupa like komen dan share juga yaa...,1829107101723209774,,KPU_JATIM,in,"Kota Surabaya, Jawa Timur",0,1,0,https://x.com/KPU_JATIM/status/1829107101723209774,714645219522678784,KPU_JATIM,positif,96.47%,positif,76.74%
1829088834845577551,Thu Aug 29 09:28:55 +0000 2024,0,Sosok Anna Muawanah yang Batal Diusung PKB di Pilkada Bojonegoro 2024 Tak Ikut Antar Setyo ke KPU https://t.co/5WckgntP3Y via @tribunnews https://t.co/PofCkBdmVd,1829088834845577551,https://pbs.twimg.com/media/GWI6mTwasAEfQuM.jpg,,in,"Surabaya, Jawa Timur",0,0,0,https://x.com/tribunjatim/status/1829088834845577551,279961400,tribunjatim,negatif,66.23%,negatif,46.42%
1829085372598587590,Thu Aug 29 09:15:10 +0000 2024,0,PDIP Usung Risma-Gus Han pada Pilkada Jatim 2024 https://t.co/E6poZQlsE5,1829085372598587590,,,in,Jakarta,0,0,0,https://x.com/ivooxid/status/1829085372598587590,745849790332805121,ivooxid,negatif,74.79%,negatif,48.24%
1829083592707678501,Thu Aug 29 09:08:05 +0000 2024,0,Masuk Masa Pendaftaran Ratusan Orang di Jatim Serukan Pilkada Jatim 2024 Aman dan Damai: pendaftaran Bakal Calon Kepala Daerah masyarakat Jawa Timur berharap munculnya berbagai calon kepala daerah yang mendaftarkan ke KPU berikan pilihan https://t.co/u4AFlGobme https://t.co/wnkZgEd037,1829083592707678501,https://pbs.twimg.com/media/GWI11a5asAAySq1.jpg,,in,"Pulo Gadung, Indonesia",0,0,0,https://x.com/tvOneNews/status/1829083592707678501,55507370,tvOneNews,negatif,67.84%,negatif,48.68%
1829082452951744944,Thu Aug 29 09:03:34 +0000 2024,0,ITB Berkarya Jatim Serukan Pilkada Damai 2024 https://t.co/xYrWqq9GCL,1829082452951744944,,,in,,0,0,0,https://x.com/OrbitNasional/status/1829082452951744944,1786658739116007424,OrbitNasional,negatif,66.74%,negatif,46.04%
1829060007595315393,Thu Aug 29 08:46:29 +0000 2024,1,@yohanwahyu76 Seperti apa kans keduanya di Pilkada Jatim 2024 ini? #Pilkada2024 #AdadiKompas https://t.co/I0sbWD8Yn9,1829078157057839566,,KompasData,in,"Palmerah, Jakarta",0,0,1,https://x.com/KompasData/status/1829078157057839566,771030588,KompasData,negatif,73.22%,negatif,50.34%
1829071513716163065,Thu Aug 29 08:20:06 +0000 2024,0,Lanskap politik Jawa Timur justru ramai di hari ketiga masa pendaftaran Pilkada 2024! Siapa saja yang nantinya berniat untuk menjadi calon gubernur? Saksikan jawabannya di episode #detikSore hari ini hanya di detikcom! #detikcom #detiksorenggacumahorehore #politik #jatim https://t.co/PoVaW8NGOK,1829071513716163065,https://pbs.twimg.com/media/GWIq2U9XsAA2bpt.jpg,,in,,0,0,0,https://x.com/detikcom/status/1829071513716163065,69183155,detikcom,negatif,63.45%,negatif,40.76%
1829058907567993142,Thu Aug 29 07:30:00 +0000 2024,0,Pilkada Kota Batu 2024 Diikuti Tiga Pasangan. Calon Krisdayanti-Kresna Dewanata didukung PDI Perjuangan NasDem dan partai koalisi non parlemen. https://t.co/csXkwtFkNd,1829058907567993142,,,in,Jl Opak 1 Surabaya,0,0,0,https://x.com/BisniscomJatim/status/1829058907567993142,333877701,BisniscomJatim,negatif,63.22%,negatif,48.36%
1829057170828341583,Thu Aug 29 07:23:06 +0000 2024,0,KPUD Jatim Masih Tunggu Kedatangan 2 Pasangan Calon Kepala Daerah: KPU Provinsi Jawa Timur masih menunggu dua pasangan calon yang rencananya akan mendaftar menjadi peserta Pilkada 2024 di hari terakhir pada Kamis (29/8/2024) ini. https://t.co/FuYol7MlAv,1829057170828341583,,,in,"Pulo Gadung, Indonesia",0,1,0,https://x.com/tvOneNews/status/1829057170828341583,55507370,tvOneNews,negatif,62.66%,negatif,42.16%
1829052637041570103,Thu Aug 29 07:14:04 +0000 2024,1,@KPU_JATIM Nah kenalan yuk sama Si Jalih dan 38 teman-temannya Untuk jingle Pilkada Jatim Serentak 2024 bisa cek di https://t.co/1bAanDtp4A yaa @jatimpemprov @adhykaryononew @kemenkominfo @kemendagri @humasprovjatim @kominfojatim @ppidjatim #optimisjatimbangkit #jatim #jatimpemprov https://t.co/Op2SF6J5wh,1829054896085389811,https://pbs.twimg.com/media/GWIbrW9WUAAvmR3.jpg,JatimPemprov,in,"Jawa Timur, Indonesia",0,0,2,https://x.com/JatimPemprov/status/1829054896085389811,771337601269714944,JatimPemprov,positif,62.18%,positif,51.65%
1829053902005956754,Thu Aug 29 07:10:07 +0000 2024,1,Gus Hans dipilih PDI-P sebagai pendamping Risma di Pilkada Jatim 2024. Gus Hans sowan ke sejumlah kiai dan mengurus dokumen ke PN Jombang. https://t.co/OfsRw9m75y,1829053902005956754,,,in,Jakarta,0,1,0,https://x.com/kompascom/status/1829053902005956754,23343960,kompascom,negatif,69.25%,negatif,49.34%
1829052891208061428,Thu Aug 29 07:06:06 +0000 2024,1,Daftar Pilkada Jatim 2024 Intip Profil dan Karier Politik Khofifah Indar Parawansa https://t.co/VFeZXVUivM #TempoCantika,1829052891208061428,,,in,Indonesia,0,0,0,https://x.com/tempodotco/status/1829052891208061428,18129942,tempodotco,negatif,74.85%,negatif,60.09%
1829052637041570103,Thu Aug 29 07:05:05 +0000 2024,1,Jelang masa penerimaan pendaftaran pasangan Cakada dan Cawakada di Pilkada Serentak 2024 KPU Jatim @kpu_jatim menggelar sosialisasi 39 maskot Pilkada Serentak 2024 (satu maskot Pilgub Jatim yakni Si Jalih dan 38 maskot Pilkada kabupaten/kota di Jatim). https://t.co/ubU4SkwDHT,1829052637041570103,https://pbs.twimg.com/media/GWIZnddasAE5mQT.jpg,,in,"Jawa Timur, Indonesia",0,3,1,https://x.com/JatimPemprov/status/1829052637041570103,771337601269714944,JatimPemprov,positif,72.35%,positif,64.45%
1829051837301006725,Thu Aug 29 07:01:54 +0000 2024,0,PDI Perjuangan resmi mengusung Tri Rismaharini dan KH Zahrul Azhar Asumta (Gus Hans) sebagai pasangan calon di Pilkada Jawa Timur 2024. Kunjungi https://t.co/mzJiG4eo2p #trirismaharini #pdip #gushans #pilkadajatim #jatim #pilkadajatim2024 #jawatimur #pilkada2024 #pilkada https://t.co/3U4mPoZBMQ,1829051837301006725,https://pbs.twimg.com/media/GWIY7OxW8AAmSqx.jpg,,in,,0,0,0,https://x.com/calonkpldaerah/status/1829051837301006725,1306873531729207303,calonkpldaerah,negatif,65.17%,positif,44.90%
1829051834901692814,Thu Aug 29 07:01:54 +0000 2024,0,Mereka akan mendaftar ke KPU Jatim pada Kamis malam (29/8/2024) didukung oleh Partai Hanura dan Partai Ummat. Baca artikel tentang Pilkada 2024 hanya di https://t.co/YHxkKmQqI2 #trirismaharini #pdip #gushans #pilkadajatim #jatim #pilkadajatim2024 #jawatimur #pilkada2024 https://t.co/kMiYd9Z01K,1829051834901692814,https://pbs.twimg.com/media/GWIY7D1asAAe_b6.jpg,,in,,0,0,0,https://x.com/Pilkadanewscom/status/1829051834901692814,1436225922735116334,Pilkadanewscom,negatif,62.17%,negatif,44.84%
1829050828994556398,Thu Aug 29 06:58:10 +0000 2024,0,[2] Pilkada Jatim ini disampaikan Sri Untari Bisowarno Sekretaris DPD PDI Perjuangan Jatim. Kata dia Risma-Gus Hans dijadwalkan mendaftar ke Kantor KPU Jatim di Jalan Raya Tenggilis Surabaya pada Kamis 29 Agustus 2024 sekitar jam 19.30 WIB malam nanti. Mereka akan berangkat,1829050895486857289,,radiopatria,in,Blitar - East Java - Indonesia,0,1,0,https://x.com/radiopatria/status/1829050895486857289,100132119,radiopatria,negatif,64.59%,negatif,42.52%
1829034223505945059,Thu Aug 29 05:51:55 +0000 2024,0,Gerak Cepat Menjelang pendaftaran Pasangan Calon (Paslon) Wali Kota dan Wakil Wali Kota Surabaya untuk Pilkada 2024 Polrestabes Surabaya meningkatkan kesiagaan. Ratusan personel diterjunkan untuk pengamanan yang terbagi menjadi beberapa lapis pengamanan. https://t.co/jVBqWZsYVP,1829034223505945059,https://pbs.twimg.com/media/GWII7eLasAE0WYy.jpg,,in,,0,0,0,https://x.com/bidhumas_jatim/status/1829034223505945059,1444824442954137603,bidhumas_jatim,negatif,54.03%,negatif,36.28%
1829033950385435084,Thu Aug 29 05:50:50 +0000 2024,2,Zahrul Azhar Asumta atau Gus Hans dipilih PDIP jadi pendamping Bu Risma di Pilkada Jatim 2024. Ia adalah tokoh muda NU yang punya pendidikan mentereng. Selengkapnya...https://t.co/8mQpT1REMB https://t.co/8mQpT1REMB,1829033950385435084,,,in,,0,1,1,https://x.com/AnisahR14/status/1829033950385435084,1373875450687098881,AnisahR14,negatif,70.32%,negatif,48.87%
1829033922522689616,Thu Aug 29 05:50:43 +0000 2024,0,Gerak Cepat Polres Madiun mengerahkan personel untuk melakukan pengamanan dalam pelaksanaan pendaftaran pasangan calon Bupati dan Wakil Bupati Pilkada serentak 2024 di Kabupaten Madiun. https://t.co/c1mlu6lE7J,1829033922522689616,https://pbs.twimg.com/media/GWIIpxQasAQ5i1b.jpg,,in,,0,0,0,https://x.com/bidhumas_jatim/status/1829033922522689616,1444824442954137603,bidhumas_jatim,positif,51.42%,positif,43.98%
1829032876228436392,Thu Aug 29 05:46:34 +0000 2024,2,3 Cagub Perempuan Bertarung Pilgub Jatim: Risma Khofifah Luluk: Tiga orang perempuan akan bertarung memperebutkan kursi gubernur Jawa Timur (Jatim) di Pilkada 2024. https://t.co/GTZdKuUaJE,1829032876228436392,,,in,"Pulo Gadung, Indonesia",1,2,0,https://x.com/tvOneNews/status/1829032876228436392,55507370,tvOneNews,negatif,73.71%,negatif,49.34%
1829032105399189805,Thu Aug 29 05:43:30 +0000 2024,3,PDI Perjuangan akhirnya memutuskan calonnnya yang akan bertarung dalam kontestasi Pilkada Jatim 2024. Pasangan calon gubernur dan wakil gubernur yang diusung yakni Tri Rismaharini dan Zahrul Azhar Asumta atau Gus Hans. Ojol INI BENERAN #TangkapMulyono Bu Risma Yanti Mbappe Sule https://t.co/e7Tnq4gZQs,1829032105399189805,https://pbs.twimg.com/media/GWIG10Ga0AA0lBD.jpg,,in,jombang,0,1,1,https://x.com/CelahNews/status/1829032105399189805,1803661603881230336,CelahNews,negatif,55.64%,positif,38.17%
1829031257239421404,Thu Aug 29 05:40:08 +0000 2024,8,PDIP Usung Risma dan Gus Han di Pilkada Jatim 2024: Akan Bersih-Bersih di Pemerintahan https://t.co/6K8E3ZFfki,1829031257239421404,,,in,Indonesia,0,0,0,https://x.com/KompasTV/status/1829031257239421404,71436318,KompasTV,negatif,68.85%,negatif,46.46%
1828984545263398932,Thu Aug 29 02:34:31 +0000 2024,0,Akhirnya terjawab sudah tanda tanya siapa pendamping Tri Rismaharini (Risma) di Pilkada Provinsi Jawa Timur 2024. Risma-Gus Hans akan mendaftar menjadi bakal calon gubernur dan calon wakil gubernur ke KPU Jatim #BURISMA #Jatim #Pilkada2024 #KPU https://t.co/CX9ROAr0pZ,1828984545263398932,,,in,,0,0,0,https://x.com/Mistar_id/status/1828984545263398932,1728987951345065984,Mistar_id,positif,49.89%,positif,51.98%
1828956984684523787,Thu Aug 29 00:45:00 +0000 2024,0,PDIP Tugaskan Tri Rismaharini Maju Pilkada Jatim Daftar ke KPU 29 Agustus 2024 https://t.co/Wb5muz6pf7,1828956984684523787,,,in,Jakarta,0,0,0,https://x.com/Kilat_com/status/1828956984684523787,174631261,Kilat_com,negatif,75.18%,negatif,50.18%
1828914161176461323,Wed Aug 28 22:12:22 +0000 2024,0,Pilkada Pilgub 2024 sekarang ini kayaknya kurang asyik diatas kertas dan survei di Jatim Jateng Jabar dan DKI Jakarta sudah diketahui cagub PDIP bakal dibabat habis.. Apakah ini bentuk perlawanan atau kesadaran nasional atau dendam yang dilampiaskan kah? Jangan sedih pdip..,1828918572497956929,,musashi_masabi,in,"Kota Semarang, Indonesia",0,0,0,https://x.com/musashi_masabi/status/1828918572497956929,916000413643501568,musashi_masabi,negatif,67.89%,negatif,43.34%
1828798440568172545,Wed Aug 28 14:15:00 +0000 2024,0,Menteri Sosial yang juga Mantan Wali Kota Surabaya Tri Risma Harini akan diusung oleh PDI-P untuk menantang petahana Khofifah Indar Parawansa. Seperti apa kans keduanya di Pilkada Jatim 2024 ini? #BahasPeristiwa #AdadiKompas https://t.co/mLaIXic6MQ,1828798440568172545,,,in,"Palmerah, Jakarta",0,0,1,https://x.com/hariankompas/status/1828798440568172545,255866913,hariankompas,negatif,65.40%,negatif,44.33%
1828756203318477185,Wed Aug 28 11:27:10 +0000 2024,0,KPU Ponorogo: Baru 2 Paslon Daftar Pilkada 2024. Ketua KPU Kabupaten Ponorogo R. Gaguk Ika Prayitno menyatakan hingga hari kedua masa pendaftaran Pilkada 2024 baru ada dua paslon yang https://t.co/oO9FUJS0Hm #PolitikPemerintahan #Jatim #kpuponorogo via @beritajatimcom,1828756203318477185,,,in,Surabaya,0,0,0,https://x.com/beritajatimcom/status/1828756203318477185,21287066,beritajatimcom,negatif,68.92%,negatif,47.72%
1828729719657041930,Wed Aug 28 09:43:14 +0000 2024,1,Pendaftaran dilaksanakan di Kantor KPU Jatim Jalan Raya Tenggilis nomor 1-3 Surabaya Rabu 28 Agustus 2024. Ketua KPU Jatim Aang Kunaifi mengajak semua pihak untuk bisa bersama-sama melaksanakan penyelenggaran Pilkada di Jatim sesuai dengan prinsip penyelenggaraan Pemilu. https://t.co/xZ21xZ671x,1828730050403095021,https://pbs.twimg.com/media/GWD0SGdbsAAX9yV.jpg,KPU_JATIM,in,"Kota Surabaya, Jawa Timur",0,1,0,https://x.com/KPU_JATIM/status/1828730050403095021,714645219522678784,KPU_JATIM,positif,63.00%,positif,47.13%
