conversation_id_str,created_at,favorite_count,full_text,id_str,image_url,in_reply_to_screen_name,lang,location,quote_count,reply_count,retweet_count,tweet_url,user_id_str,username,Prediksi_Naive_Bayes,Probabilitas_NB,Prediksi_Logistic_Regression,Probabilitas_LR
1850094402276098403,Sat Oct 26 08:37:33 +0000 2024,0,Debat Publik Perdana Pilkada Jember 2024 Ini Imbauan KPU - https://t.co/ucjuE1o7EE,1850094402276098403,,,in,Malang,0,0,0,https://x.com/tugujatim/status/1850094402276098403,1299135979010142208,tugujatim,positif,80.65%,positif,57.81%
1850075185686381033,Sat Oct 26 07:21:11 +0000 2024,0,Ormas MADAS Dukung Penuh Pilkada Damai Jatim 2024. Ormas MADAS dukung penuh Pilkada Jatim 2024 dengan mendirikan posko damai di Surabaya. MADAS bersama Polda Jatim berkomitmen menciptakan https://t.co/QD3NeMkrt4 #PolitikPemerintahan #beritajatim #Jatim via @beritajatimcom,1850075185686381033,,,in,Surabaya,0,0,0,https://x.com/beritajatimcom/status/1850075185686381033,21287066,beritajatimcom,positif,52.20%,positif,60.95%
1850027472047440262,Sat Oct 26 04:11:35 +0000 2024,0,Kholilurrahman Kembali Ajak Masyarakat Sukseskan Pilkada Pamekasan. KH Kholilurrahman Calon Bupati Pamekasan mengajak masyarakat menjaga budaya santun dan damai jelang Pilkada 2024 https://t.co/azTHZum0J3 #PolitikPemerintahan #beritajatim #Jatim via @beritajatimcom,1850027472047440262,,,in,Surabaya,0,0,0,https://x.com/beritajatimcom/status/1850027472047440262,21287066,beritajatimcom,negatif,51.44%,positif,52.24%
1850011720376516878,Sat Oct 26 03:09:00 +0000 2024,0,Elektabilitas Risma Kejar Khofifah Hasil Survei Pilkada Jatim 2024 Usai Debat Ada Kenaikan Tipis https://t.co/OZH5Tiw1Ih lewat @tribunkaltim,1850011720376516878,,,in,"Balikpapan, Indonesia",0,0,0,https://x.com/tribunkaltim/status/1850011720376516878,103551225,tribunkaltim,positif,68.25%,positif,57.92%
1849971282210848941,Sat Oct 26 00:28:19 +0000 2024,2,Pilkada Jatim 2024 menunjukkan adanya pengabaian terhadap isu lingkungan hidup. Komisi Pemilihan Umum (KPU) Jawa Timur telah menetapkan tiga kali debat dengan tema yang mencakup pendidikan kesehatan kependudukan kedaulatan pangan ekonomi infrastruktur serta hukum dan HAM,1849971282210848941,,,in,"Sidoarjo, Indonesia",0,1,0,https://x.com/WalhiJatim/status/1849971282210848941,793879224,WalhiJatim,positif,88.59%,positif,70.17%
1849970089392734417,Sat Oct 26 00:23:34 +0000 2024,0,Cawagub nomor urut 3 KH Zahrul Azhar Asumta menyambangi Bondowoso tim relawan menargetkan meraih kemenangan 60 persen Pilkada Jatim 2024 di Bondowoso https://t.co/uXcTGRhkTt #PilgubJatim2024 #PilkadaBondowoso2024 #RismaGusHans,1849970089392734417,,,in,Surabaya,0,0,0,https://x.com/ngopibareng_id/status/1849970089392734417,1291246080269545472,ngopibareng_id,negatif,69.19%,negatif,46.65%
1849925229864419819,Fri Oct 25 21:25:19 +0000 2024,0,Silaturahmi Ke Ketua PSHT Ranting Senori Kapolsek Senori Polres Tuban Polda Jatim AKP Bambang Edi Nofantoro Sampaikan Pesan Pilkada 2024 Aman Dan Damai @DivHumas_Polri @1polrestuban @PolsekSenori @bidhumas_jatim #polisi #police #polisiviral #polisijatim #polri #polripresisi https://t.co/ErbsSYuRgJ,1849925229864419819,https://pbs.twimg.com/media/GaxBMRLbcAAdPcD.jpg,,in,,0,0,0,https://x.com/PolsekSenori/status/1849925229864419819,1415071104167604224,PolsekSenori,negatif,81.19%,negatif,57.87%
1849873761299988935,Fri Oct 25 18:00:48 +0000 2024,0,Elektabilitas Risma Kejar Khofifah Hasil Survei Pilkada Jatim 2024 Usai Debat Ada Kenaikan Tipis https://t.co/huHh0az0W4,1849873761299988935,,,in,Indonesia,0,0,0,https://x.com/MSNindonesia/status/1849873761299988935,262026799,MSNindonesia,positif,68.51%,positif,57.65%
1849820089438306790,Fri Oct 25 14:27:31 +0000 2024,0,Elektabilitas Risma Kejar Khofifah Hasil Survei Pilkada Jatim 2024 Usai Debat Ada Kenaikan Tipis https://t.co/OZH5Tiw1Ih lewat @tribunkaltim,1849820089438306790,,,in,"Balikpapan, Indonesia",0,0,0,https://x.com/tribunkaltim/status/1849820089438306790,103551225,tribunkaltim,positif,68.25%,positif,57.92%
1849782314445996508,Fri Oct 25 11:57:25 +0000 2024,0,Pengamanan Ketat Logistik Pilkada Serentak 2024 di Tuban CCTV dan Personel Siaga 24 Jam Nonstop - https://t.co/KAvHtjLJZd,1849782314445996508,,,in,Malang,0,0,0,https://x.com/tugujatim/status/1849782314445996508,1299135979010142208,tugujatim,negatif,59.89%,negatif,40.53%
1849774723678470231,Fri Oct 25 11:27:15 +0000 2024,0,Polda Jatim Siap Kawal dan Amankan Pendistribusian Surat Suara Pilkada 2024 https://t.co/epklZSZPlh lewat @Beritakisahnyata.com - Akurat Berimbang dan Terpercaya,1849774723678470231,,,in,"Surabaya, jawa timur, indonesi",0,0,0,https://x.com/Beritakisahnya2/status/1849774723678470231,780374143501864960,Beritakisahnya2,positif,49.86%,positif,39.24%
1849722785511375166,Fri Oct 25 08:00:52 +0000 2024,0,Hari Ini Lima Panelis Bakal Kawal Debat Perdana Pilkada Kota Mojokerto 2024 - https://t.co/ap2HvAVXAn,1849722785511375166,,,in,Malang,0,0,0,https://x.com/tugujatim/status/1849722785511375166,1299135979010142208,tugujatim,positif,57.68%,positif,41.71%
1849718304488947814,Fri Oct 25 07:43:04 +0000 2024,0,KPU Blitar Tegaskan Profesional dan Netral di Pilkada 2024. Ketua Komisi Pemilihan Umum (KPU) Kabupaten Blitar Sugino menegaskan bahwa pihaknya terus berkomitmen menjaga netralitas https://t.co/jx8ihBGX0y #PolitikPemerintahan #beritajatim #Blitar #Jatim via @beritajatimcom,1849718304488947814,,,in,Surabaya,0,0,0,https://x.com/beritajatimcom/status/1849718304488947814,21287066,beritajatimcom,negatif,73.21%,negatif,50.95%
1849703003663761609,Fri Oct 25 06:42:16 +0000 2024,0,Ada Hadiah Motor dan Sepeda untuk Pemilih Pilkada 2024 https://t.co/jKGG1hJjj3,1849703003663761609,,,in,Jl Opak 1 Surabaya,0,0,0,https://x.com/BisniscomJatim/status/1849703003663761609,333877701,BisniscomJatim,positif,45.75%,positif,35.61%
1849667711045075003,Fri Oct 25 04:22:02 +0000 2024,4,Doorstop Gangguan Kamtibmas Menjelang Pilkada 2024 di wilayah Jawa Timur @divisihumaspolri #pilkada2024amandamai #humaspolri #humaspoldajatim #Kapoldajatim #poldajatim #Multimedia #polri #presisi #jatimbangkitterusmelaju https://t.co/gMGxIbZywV,1849667711045075003,https://pbs.twimg.com/ext_tw_video_thumb/1849667652215824384/pu/img/d1dt3HDjoJH6MhZL.jpg,,in,,0,0,1,https://x.com/bidhumas_jatim/status/1849667711045075003,1444824442954137603,bidhumas_jatim,positif,50.50%,positif,43.75%
1849629844252000666,Fri Oct 25 01:51:33 +0000 2024,0,Kapolda dan Pj Gubernur Jatim Tinjau Kesiapan Surat Suara Pilkada 2024 di Gresik. Menjelang pelaksanaan Pilkada serentak yang akan digelar akhir bulan depan berbagai persiapan logistik https://t.co/V3A3wehgDp #HukumKriminal #adhykaryono #ImamSugianto via @beritajatimcom,1849629844252000666,,,in,Surabaya,0,0,0,https://x.com/beritajatimcom/status/1849629844252000666,21287066,beritajatimcom,negatif,49.62%,positif,50.64%
1849476967709753695,Thu Oct 24 15:44:05 +0000 2024,0,KPU Pasuruan Gelar Bimtek Jelang Pemilu 2024 Teknis Pemungutan Suara Masih Dinanti. Komisi Pemilihan Umum (KPU) Kabupaten Pasuruan menggelar Bimbingan Teknis (Bimtek) Pemungutan dan https://t.co/1hmePoqkDH #Peristiwa #Jatim #KPU #Pasuruan #pilkada via @beritajatimcom,1849476967709753695,,,in,Surabaya,0,0,0,https://x.com/beritajatimcom/status/1849476967709753695,21287066,beritajatimcom,positif,59.99%,positif,65.68%
1849460678723326324,Thu Oct 24 14:39:21 +0000 2024,0,Sarasehan Dengan Awak Media Jajaran Polda Jatim 2024\n Sinergitas Polri Dan Awak Media Untuk Menjaga Kondusifitas Kamtibmas Dalam Pelaksanaan Pilkada Tahun 2024 Di Jawa Timur \n\n@divisihumaspolri\n\n#pilkada2024amandamai #pilgubjatimsenengbareng #humaspolri #humaspoldajatim https://t.co/LWZg0OT3sl,1849460678723326324,https://pbs.twimg.com/ext_tw_video_thumb/1849459896917614592/pu/img/QDDXNfLGUYgn3XVU.jpg,,in,,0,0,0,https://x.com/PolsekKalidawir/status/1849460678723326324,1586728360880709632,PolsekKalidawir,negatif,50.56%,positif,44.24%
1849412860218310819,Thu Oct 24 11:29:20 +0000 2024,7,Kapolda Jatim Ikuti Rakor Kesiapan dilanjutkan dengan Monitoring Logistik (Pencetakan Surat Suara) Pilkada Serentak Tahun 2024 oleh KPU Provinsi dan Forkopimda Jatim pada Kamis 24 Oktober 2024 @divisihumaspolri #humaspolri #humaspoldajatim #Kapoldajatim #poldajatim https://t.co/UcioFhY4c9,1849412860218310819,https://pbs.twimg.com/ext_tw_video_thumb/1849412632085995520/pu/img/cgPTHJSreXezhS7-.jpg,,in,,0,0,1,https://x.com/bidhumas_jatim/status/1849412860218310819,1444824442954137603,bidhumas_jatim,positif,50.24%,positif,46.80%
1849393392855523815,Thu Oct 24 10:13:17 +0000 2024,1,Ia berharap kirab maskot bisa berbanding lurus dengan peningkatan partisipasi masyarakat pada Pilkada serentak 2024 di Jawa Timur.,1849393719268749742,,KPU_JATIM,in,"Kota Surabaya, Jawa Timur",0,1,1,https://x.com/KPU_JATIM/status/1849393719268749742,714645219522678784,KPU_JATIM,positif,77.97%,positif,73.10%
1849393392855523815,Thu Oct 24 10:12:55 +0000 2024,0,Ketua KPU Jatim Aang Kunaifi menjelaskan Kirab Maskot Pilkada Serentak Jawa Timur dimulai sejak Juli hingga Oktober 2024. Aang mengatakan kirab yang digelar merupakan kreativitas dari KPU Jatim dengan dukungan KPU kabupaten/ kota untuk mensosialisasikan Pilkada serentak 2024.,1849393629049368927,,KPU_JATIM,in,"Kota Surabaya, Jawa Timur",0,1,0,https://x.com/KPU_JATIM/status/1849393629049368927,714645219522678784,KPU_JATIM,positif,86.76%,positif,61.41%
1849393392855523815,Thu Oct 24 10:11:59 +0000 2024,7,#TemanPemilih Komisi Pemilihan Umum Provinsi Jawa Timur (KPU Jatim) menggelar Media Briefing Persiapan Puncak Kirab Maskot Pilkada Serentak Tahun 2024 Se-Jawa Timur. https://t.co/4TPfs8tGoD,1849393392855523815,https://pbs.twimg.com/media/GapdfFUbgAA_rNL.jpg,,in,"Kota Surabaya, Jawa Timur",0,1,1,https://x.com/KPU_JATIM/status/1849393392855523815,714645219522678784,KPU_JATIM,positif,79.65%,positif,66.13%
1849380494955454662,Thu Oct 24 09:20:44 +0000 2024,0,Tular Nalar X UPN Veteran Jatim: Wujudkan Generasi Fasih Demokrasi Jelang Pilkada 2024 https://t.co/HPzVT2A5jb,1849380494955454662,,,in,Indonesia,0,0,0,https://x.com/jurnalpostcom/status/1849380494955454662,550714680,jurnalpostcom,negatif,59.13%,negatif,43.81%
1849371506977157526,Thu Oct 24 08:45:01 +0000 2024,0,Mustasyar Pengurus Besar Nahdhatul Ulama (PBNU) periode 2022-2027 KH. Aqil Siradj mengingatkan agar pengurus di seluruh tingkata tidak membawa lembaga untuk memberikan dukungan ke salah satu pasangan calon pada Pemilihan Kepala Daerah (Pilkada) 2024. https://t.co/Q0ZWfTA3Lo,1849371506977157526,,,in,Jawa Timur,0,0,0,https://x.com/ANTARAJatim_/status/1849371506977157526,1557190679553769473,ANTARAJatim_,negatif,52.96%,negatif,45.38%
1849367697488011736,Thu Oct 24 08:29:53 +0000 2024,0,[ Visitasi Pengawasan KIP pada Pilkada Sultra 2024 ] Bersamaan dengan Aceh Babel dan Jatim visitasi pengawasan keterbukaan informasi publik dalam Pilkada 2024 serempak di 4 daerah rawan juga dilaksanakan di Sulawesi Tenggara. https://t.co/m5owNlocN7,1849367697488011736,https://pbs.twimg.com/ext_tw_video_thumb/1849367545763319809/pu/img/WNE7tlYNd796wXUQ.jpg,,in,Jl. Abdul Muis No.40 Jakarta,0,6,0,https://x.com/KIPusat/status/1849367697488011736,602415739,KIPusat,negatif,66.52%,negatif,53.81%
1849366891334443070,Thu Oct 24 08:26:41 +0000 2024,1,[ Visitasi Pengawasan KIP pada Pilkada Jatim 2024 ] ️ Pada kegiatan yang diselenggarakan 14-15 Oktober 2024 ini tim KI Pusat juga menyambangi KPU Kab. Sampang untuk mengumpulkan fakta terkait pengawasan pelaksanaan keterbukaan informasi publik pada Pilkada Jatim 2024 https://t.co/wsiJnlY0YG,1849366891334443070,https://pbs.twimg.com/ext_tw_video_thumb/1849362104912097281/pu/img/YxYTP_jvpRIiftHl.jpg,,in,Jl. Abdul Muis No.40 Jakarta,0,0,1,https://x.com/KIPusat/status/1849366891334443070,602415739,KIPusat,negatif,56.76%,negatif,39.04%
1849354660421026220,Thu Oct 24 07:38:05 +0000 2024,0,Debat Paslon Pilkada Ponorogo Upaya Tingkatkan Literasi Politik Masyarakat. Debat publik pertama peserta pemilihan kepala daerah (Pilkada) Ponorogo tahun 2024 pada Rabu (23/10) malam https://t.co/bSHXUKmmHo #PolitikPemerintahan #Jatim #kpuponorogo via @beritajatimcom,1849354660421026220,,,in,Surabaya,0,0,0,https://x.com/beritajatimcom/status/1849354660421026220,21287066,beritajatimcom,positif,51.35%,positif,49.95%
1849351930092703849,Thu Oct 24 07:27:14 +0000 2024,0,Tular Nalar X UPN Veteran Jatim: Wujudkan Generasi Fasih Demokrasi Jelang Pilkada 2024 https://t.co/HPzVT2A5jb,1849351930092703849,,,in,Indonesia,0,0,0,https://x.com/jurnalpostcom/status/1849351930092703849,550714680,jurnalpostcom,negatif,59.13%,negatif,43.81%
1849328907104965115,Thu Oct 24 05:55:44 +0000 2024,0,Sarasehan Dengan Awak Media Jajaran Polda Jatim 2024 Sinergitas Polri Dan Awak Media Untuk Menjaga Kondusifitas Kamtibmas Dalam Pelaksanaan Pilkada Tahun 2024 Di Jawa Timur Bersama Menjamin Kelancaran Demokrasi Kita #KawalPilkadaDamai https://t.co/f9n0NLs8pp,1849328907104965115,https://pbs.twimg.com/ext_tw_video_thumb/1849328827161559040/pu/img/ZHFpFiKXMI4U8Uvf.jpg,,in,"Situbondo, Indonesia",0,0,0,https://x.com/pidressitubondo/status/1849328907104965115,218735896,pidressitubondo,negatif,51.39%,positif,45.27%
1849322757437464601,Thu Oct 24 05:31:18 +0000 2024,0,Komisi Pemilihan Umum Provinsi Jawa Timur (KPU Jatim) menggelar Kirab Maskot Pilkada Serentak se-Jawa Timur 2024. https://t.co/Dr5sTaf6UK https://t.co/lMNnkbnoa6,1849322757437464601,https://pbs.twimg.com/media/GaodPi2boAAlvyD.jpg,,in,Jakarta Capital Region,0,0,0,https://x.com/siagadotid/status/1849322757437464601,1309968856266321920,siagadotid,positif,81.55%,positif,69.89%
1849322084352331867,Thu Oct 24 05:28:38 +0000 2024,56,Adanya deklarasi Pilkada damai dari Polri TNI penyelenggara pesta demokrasi serta berbagai unsur elemen masyarakat diharapkan pelaksanaan Pilkada serentak 2024 dapat berlangsung dengan adil jujur dan damai. https://t.co/7lpt7seVJQ,1849322084352331867,https://pbs.twimg.com/media/GaocmoEacAAPjHl.jpg,,in,,17,19,23,https://x.com/bidhumas_jatim/status/1849322084352331867,1444824442954137603,bidhumas_jatim,positif,71.97%,positif,64.97%
1849322014462677207,Thu Oct 24 05:28:21 +0000 2024,5,Polda Jatim Cek Kelayakan Almatsus dan Ranmor di Polres Ngawi Jelang Pilkada 2024. #pilkada2024damai #Poldajatim #PolresNgawi https://t.co/4ZxmyLHAiy,1849322014462677207,https://pbs.twimg.com/media/GaockkAaEAAc8Iv.jpg,,in,,0,0,2,https://x.com/ResNgawi/status/1849322014462677207,2152483394,ResNgawi,negatif,51.02%,positif,45.70%
1849314943000363112,Thu Oct 24 05:00:15 +0000 2024,31,Tri risma menyapa pedagang kaki lima yang banyak berjualan di Lapangan Gulun di sela berkampanye di Kota Madiun. Kepada PKL Risma berjanji akan nembawa mereka naik kelas bila menang dalam Pilkada Jatim 2024. Menurut mantan wali kota Surabaya ini bila PKL dan UMKM bisa ditata https://t.co/xU2XkbLg9F,1849314943000363112,https://pbs.twimg.com/ext_tw_video_thumb/1849314853292535808/pu/img/GKnWQFBynStFfe8y.jpg,,in,lokalisasi kelas teri,0,0,7,https://x.com/triwul82/status/1849314943000363112,2695463725,triwul82,negatif,81.19%,negatif,53.34%
1849305762843267269,Thu Oct 24 04:23:46 +0000 2024,4,Sarasehan Dengan Awak Media Jajaran Polda Jatim 2024 Sinergitas Polri Dan Awak Media Untuk Menjaga Kondusifitas Kamtibmas Dalam Pelaksanaan Pilkada Tahun 2024 Di Jawa Timur @divisihumaspolri #pilkada2024amandamai #pilgubjatimsenengbareng #humaspolri #humaspoldajatim https://t.co/UTBjzZwA5b,1849305762843267269,https://pbs.twimg.com/ext_tw_video_thumb/1849305360450097152/pu/img/bqOoJZxdwpCGiAxD.jpg,,in,,0,0,1,https://x.com/bidhumas_jatim/status/1849305762843267269,1444824442954137603,bidhumas_jatim,negatif,50.56%,positif,44.24%
1849297173009293378,Thu Oct 24 03:49:38 +0000 2024,0,Relawan Khofifah-Emil menyediakan kopi gratis di Warkop Bolo Khofifah yang terletak di kawasan Perak Surabaya untuk mempertebal kemenangan pasangan tersebut di Pemilihan Kepala Daerah (Pilkada) 2024. https://t.co/OF5uS3eob5,1849297173009293378,,,in,Jawa Timur,0,0,0,https://x.com/ANTARAJatim_/status/1849297173009293378,1557190679553769473,ANTARAJatim_,positif,53.89%,positif,42.45%
1849245483803550063,Thu Oct 24 00:24:15 +0000 2024,0,Sambang Warga Anggota Polmas Polsek Senori Polres Tuban Melaksanakan Sosialisasi Pilkada 2024 Aman dan Damai Kepada Warga Desa Kaligede @DivHumas_Polri @1polrestuban @PolsekSenori @bidhumas_jatim #polisi #police #polisiviral #polisijatim #polri #polripresisi #polisiindonesia https://t.co/FEYomul4by,1849245483803550063,https://pbs.twimg.com/media/GanW9ydaUAA50oH.jpg,,in,,0,0,0,https://x.com/PolsekSenori/status/1849245483803550063,1415071104167604224,PolsekSenori,negatif,74.94%,negatif,58.45%
1849136790080553330,Wed Oct 23 17:12:20 +0000 2024,0,Sinergitas Polres dan awak media di Jajaran Polda Jatim untuk menjaga kondusifitas kamtibmas dalam pelaksanaan Pilkada 2024 #kapolresprobolinggokota #polresprobolinggokota #kotaprobolinggo https://t.co/axN3qY3CHR,1849136790080553330,https://pbs.twimg.com/media/Gal0HDYbsAAfhUg.jpg,,in,,0,0,0,https://x.com/sekmayangan1_0/status/1849136790080553330,1452500582569103361,sekmayangan1_0,negatif,63.09%,negatif,44.78%
1849136091124879504,Wed Oct 23 17:09:34 +0000 2024,0,Kirab Maskot Pilkada 2024 Meriah KPU Jatim Minta Masyarakat Datang ke TPS. KPU Jatim dalam Puncak Kirab Maskot Pilkada Serentak 2024 di Surabaya mengajak masyarakat agar turut mensukseskan Pilkada https://t.co/mt1pKSy7nd #PolitikPemerintahan #kpujatim via @beritajatimcom,1849136091124879504,,,in,Surabaya,0,0,0,https://x.com/beritajatimcom/status/1849136091124879504,21287066,beritajatimcom,positif,50.92%,positif,50.94%
1849091202010009742,Wed Oct 23 14:11:11 +0000 2024,0,Meriah 39 Maskot Pilkada Serentak Jatim 2024 Dikirab Keliling Surabaya https://t.co/pRTjpBH3Yh https://t.co/Y9W7Ul064W,1849091202010009742,https://pbs.twimg.com/media/GalKpjJa4AEeRWk.jpg,,in,"Solo, Central Java, Indonesia",0,0,0,https://x.com/soloposdotcom/status/1849091202010009742,155169715,soloposdotcom,positif,60.35%,positif,52.86%
1849040785213358418,Wed Oct 23 10:50:51 +0000 2024,0,Sinergitas Polres dan awak media di Jajaran Polda Jatim untuk menjaga kondusifitas kamtibmas dalam pelaksanaan Pilkada 2024 #kapolresprobolinggokota #polresprobolinggokota #kotaprobolinggo https://t.co/ethE8mXOBD,1849040785213358418,https://pbs.twimg.com/media/Gakcy5VaYAAou-D.jpg,,in,,0,0,0,https://x.com/PolsubKedopok/status/1849040785213358418,1593151411423846400,PolsubKedopok,negatif,63.09%,negatif,44.78%
1849039105440813556,Wed Oct 23 10:44:10 +0000 2024,0,Sinergitas Polres dan awak media di Jajaran Polda Jatim untuk menjaga kondusifitas kamtibmas dalam pelaksanaan Pilkada 2024 #kapolresprobolinggokota #polresprobolinggokota #kotaprobolinggo https://t.co/vAphiuS46l,1849039105440813556,https://pbs.twimg.com/media/GakbQoabMAEsqZT.jpg,,in,,0,0,0,https://x.com/KanigaranKa1/status/1849039105440813556,1608733302302871555,KanigaranKa1,negatif,63.09%,negatif,44.78%
1849032995505889437,Wed Oct 23 10:19:54 +0000 2024,2,Sinergitas Polres dan awak media di Jajaran Polda Jatim untuk menjaga kondusifitas kamtibmas dalam pelaksanaan Pilkada 2024 #kapolresprobolinggokota #polresprobolinggokota #kotaprobolinggo https://t.co/m4gtivqpRF,1849032995505889437,https://pbs.twimg.com/media/GakVtbXboAAAFBZ.jpg,,in,,0,0,3,https://x.com/PolresProboKota/status/1849032995505889437,1304312331216666629,PolresProboKota,negatif,63.09%,negatif,44.78%
1849004867291099519,Wed Oct 23 08:28:07 +0000 2024,3,Kabagops Polrestabes Surabaya pimpin pelaksanaan apel gabungan dalam rangka Kesiapan Pengamanan Kirab Maskot Pilkada Serentak Tahun 2024 Se Jawa Timur pada pada Rabu 23 Oktober 2024 di Kantor Gubernur Jawa Timur @divisihumaspolri #humaspolri #humaspoldajatim #Kapoldajatim https://t.co/bLKQ8n5lzS,1849004867291099519,https://pbs.twimg.com/ext_tw_video_thumb/1849004824513425408/pu/img/Nzz_AABstqPP6UE9.jpg,,in,,0,0,2,https://x.com/bidhumas_jatim/status/1849004867291099519,1444824442954137603,bidhumas_jatim,positif,62.34%,positif,56.01%
1848962595023425625,Wed Oct 23 05:40:09 +0000 2024,0,Bawaslu Kota Mojokerto Petakan Potensi Kerawanan DPPh Pilkada 2024. Bawaslu Kota Mojokerto memetakan potensi kerawanan dalam pengawasan penyusunan DPPh dan membuka posko Kawal Hak Pilih https://t.co/p1Ors0aVOE #Peristiwa #bawaslukotamojokerto #Jatim via @beritajatimcom,1848962595023425625,,,in,Surabaya,0,0,0,https://x.com/beritajatimcom/status/1848962595023425625,21287066,beritajatimcom,negatif,77.08%,negatif,56.28%
1848921095602377006,Wed Oct 23 02:55:15 +0000 2024,0,Badan Pengawas Pemilihan Umum (Bawaslu) dan Sentra Gakkumdu Kabupaten Situbondo Jawa Timur memproses dugaan tindak pidana pelanggaran netralitas dilakukan oknum kepala desa dengan mengajak dan mendukung salah satu pasangan calon peserta Pilkada 2024. https://t.co/cMIpS5ZLEN,1848921095602377006,,,in,Jawa Timur,0,0,0,https://x.com/ANTARAJatim_/status/1848921095602377006,1557190679553769473,ANTARAJatim_,positif,59.89%,positif,51.54%
1848909627074949566,Wed Oct 23 02:09:40 +0000 2024,5,Polisi Harus Netral Dalam Pilkada 2024 Untuk Kondusifitas #Jatim #Madura #Sampang #Pilkada2024 #Polisi #Netral #NU #Muhammadiyah #LDII #Ansor @DivHumas_Polri @HumasPoldaJatim @ListyoSigitP @prabowo @bawaslu_RI @bawaslujatim @bawaslusampang https://t.co/HgjHufLqZk,1848909627074949566,https://pbs.twimg.com/media/GailgK8bEAASi88.jpg,,in,"Sampang, Jawa Timur",0,0,5,https://x.com/BangUcup88News/status/1848909627074949566,926720944810311681,BangUcup88News,positif,47.29%,positif,45.99%
1848807510804992508,Tue Oct 22 19:23:58 +0000 2024,0,dan saya juga berharap nantinya seluruh santri yang telah memiliki hak pilih dapat menyalurkan hak suaranya pada Pilkada Tahun 2024 ucap Eka. #kpu_ri #kpu_jatim #kpukabkediri #KPUMelayani #PilkadaSerentak2024 #PilgubJatimSenengBareng #PilkadaJujurKediriMakmur,1848807529410884051,,KPU_Kediri,in,Kediri - Jawa Timur,0,0,0,https://x.com/KPU_Kediri/status/1848807529410884051,273710709,KPU_Kediri,negatif,66.03%,negatif,54.02%
1848731981359812891,Tue Oct 22 14:24:15 +0000 2024,0,Ketua KPU Mochammad Afifuddin menekankan logistik merupakan instrumen yang sangat penting dalam penyelenggaraan Pilkada serentak 2024.,1848732102843613611,,KPU_JATIM,in,"Kota Surabaya, Jawa Timur",0,1,0,https://x.com/KPU_JATIM/status/1848732102843613611,714645219522678784,KPU_JATIM,positif,63.73%,positif,57.07%
1848711428473295349,Tue Oct 22 13:02:06 +0000 2024,0,Pengamanan Debat Perdana Pilkada Polres Ponorogo Kerahkan Ratusan Personel. Polres Ponorogo bakal mengerahkan ratusan personel gabungan untuk pengamanan debat perdana Pilkada 2024 di https://t.co/CU6MR17qHR #PolitikPemerintahan #beritajatim #Jatim via @beritajatimcom,1848711428473295349,,,in,Surabaya,0,0,0,https://x.com/beritajatimcom/status/1848711428473295349,21287066,beritajatimcom,positif,63.15%,positif,58.15%
1848710606762979415,Tue Oct 22 12:58:52 +0000 2024,1,Pj Gubernur Jatim Optimistis Pilkada Serentak Tahun 2024 Aman dan Damai #jatimdamai Raffi Ahmad 20 T Pecat Atletico Madrid Agus CAT 6 Indomie Terawan JAEMIN AT GUCCI EXHIBITION https://t.co/946ZA4Dm05,1848710613046075777,https://pbs.twimg.com/media/GafwaVQbEAEk2Bw.jpg,PenaSejawat,in,"Magetan, Jawa Timur",0,0,1,https://x.com/PenaSejawat/status/1848710613046075777,1631476856770936832,PenaSejawat,positif,63.46%,positif,52.15%
1848709777779789984,Tue Oct 22 12:56:48 +0000 2024,0,Pj Gubernur Jatim Optimistis Pilkada Serentak Tahun 2024 Aman dan Damai https://t.co/nxXclpBMr4,1848710092553916689,https://pbs.twimg.com/media/GafwBqsagAAO2V8.jpg,p_benteng,in,"Malang, Jawa Timur",0,0,0,https://x.com/p_benteng/status/1848710092553916689,1648504180871684101,p_benteng,positif,63.62%,positif,57.15%
1848709891994882155,Tue Oct 22 12:56:01 +0000 2024,1,Komunitas Pencinta Kopi Dukung Pilkada Jatim 2024 Aman dan Damai #jatimdamai President Putin Zita Anjani Agus CAT 6 #HaechanDeserveBetter JAEMIN AT GUCCI EXHIBITION Raffi Ahmad 20 T https://t.co/QvZt2s7xT4,1848709897850130814,https://pbs.twimg.com/media/GafvsCCbEAQrOe9.jpg,indonesia_kisah,in,"Malang, Jawa Timur",0,0,1,https://x.com/indonesia_kisah/status/1848709897850130814,1709802751071526912,indonesia_kisah,positif,62.88%,positif,54.59%
1848709891994882155,Tue Oct 22 12:56:00 +0000 2024,1,Komunitas Pencinta Kopi Dukung Pilkada Jatim 2024 Aman dan Damai #jatimdamai President Putin Zita Anjani Agus CAT 6 #HaechanDeserveBetter JAEMIN AT GUCCI EXHIBITION Raffi Ahmad 20 T https://t.co/cdExmEHZt9,1848709891994882155,https://pbs.twimg.com/ext_tw_video_thumb/1848709659433308161/pu/img/KLROT1FbRB9v4Dsx.jpg,,in,"Malang, Jawa Timur",0,1,1,https://x.com/indonesia_kisah/status/1848709891994882155,1709802751071526912,indonesia_kisah,positif,62.88%,positif,54.59%
1848709777779789984,Tue Oct 22 12:55:33 +0000 2024,0,Komunitas Pencinta Kopi Dukung Pilkada Jatim 2024 Aman dan Damai https://t.co/Brf8w5OZGU,1848709777779789984,https://pbs.twimg.com/media/GafvuwuakAAoiVf.jpg,,in,"Malang, Jawa Timur",0,1,0,https://x.com/p_benteng/status/1848709777779789984,1648504180871684101,p_benteng,positif,58.09%,positif,61.02%
1848708721364586954,Tue Oct 22 12:51:21 +0000 2024,0,Komunitas Pencinta Kopi Dukung Pilkada Jatim 2024 Aman dan Damai https://t.co/3a5g58BTys,1848708721364586954,https://pbs.twimg.com/ext_tw_video_thumb/1848708479080665089/pu/img/iVyXBFR7fdUs6bnn.jpg,,in,"Ponorogo, Jawa Timur",0,1,0,https://x.com/IndonesiakuBumi/status/1848708721364586954,1640921231573790722,IndonesiakuBumi,positif,58.09%,positif,61.02%
1848703237068886110,Tue Oct 22 12:29:33 +0000 2024,0,Jajaran Polda Jatim Gelar Sarasehan dengan Awak Media Sukseskan Pilkada Serentak 2024 https://t.co/MgjLy5ojYt,1848703237068886110,,,in,"Lumajang, Indonesia",0,0,0,https://x.com/kelumajangcom/status/1848703237068886110,1625021324551942145,kelumajangcom,positif,72.25%,positif,54.49%
