conversation_id_str,created_at,favorite_count,full_text,id_str,image_url,in_reply_to_screen_name,lang,location,quote_count,reply_count,retweet_count,tweet_url,user_id_str,username,Prediksi_Naive_Bayes,Probabilitas_NB,Prediksi_Logistic_Regression,Probabilitas_LR
1838567016745095474,Tue Sep 24 13:11:50 +0000 2024,3,Dalam sambutannya Adhi Karyono meminta Nur Kholis untuk dapat melaksanakan tanggung jawab penuh sebagai Pj Bupati Pasuruan. Khususnya dapat mengawal Pembangunan dan Pilkada Serentak 2024 yang akan dilaksanakan pada hari Rabu 27 November mendatang. https://t.co/uwMq2hTWtY,1838567016745095474,https://pbs.twimg.com/media/GYPmx99bsAEZ6CS.jpg,,in,Jl. Wisata  Menanggal No. 38,0,0,0,https://x.com/dlhjatim/status/1838567016745095474,841433663241826304,dlhjatim,negatif,53.26%,positif,40.36%
1838559650356011200,Tue Sep 24 12:42:34 +0000 2024,2,IKA UPN Veteran Jatim Tegaskan Netral dan Tidak Terlibat Politik Praktis di Pilkada 2024 https://t.co/lIE3sbOYZf,1838559650356011200,,,in,"Kota Surabaya, Jawa Timur",0,0,0,https://x.com/e100ss/status/1838559650356011200,848614550,e100ss,positif,54.90%,positif,47.83%
1838559558685593911,Tue Sep 24 12:42:12 +0000 2024,0,Sosok Cagub-Cawagub Pilkada Jatim 2024 3 Srikandi Khofifah-Risma-Luluk Disertai Harta Kekayaannya https://t.co/Biei7zgvV1 via @tribunnews,1838559558685593911,,,in,"Surabaya, Jawa Timur",0,0,0,https://x.com/tribunjatim/status/1838559558685593911,279961400,tribunjatim,negatif,76.49%,negatif,47.75%
1838557086676041973,Tue Sep 24 12:32:22 +0000 2024,0,KPU Sidoarjo Pleno Terbuka Tetapkan Nomor Urut Paslon Pilkada 2024 https://t.co/cJZY7l2VFV,1838557086676041973,,,in,"Surabaya, Jawa Timur",0,0,1,https://x.com/KominfoJatim/status/1838557086676041973,1569962529178402817,KominfoJatim,negatif,55.22%,positif,37.94%
1838542872087532007,Tue Sep 24 11:35:53 +0000 2024,0,KPU Jawa Timur membentuk Satgas Demokrasi untuk mengajak generasi muda khususnya mahasiswa berperan aktif dalam Pilkada Jatim 2024. Mahasiswa diharapkan mampu menangkal hoaks dengan memverifikasi informasi dari berbagai sumber guna menjaga integritas demokrasi. https://t.co/WcM18Q9S9A,1838542872087532007,https://pbs.twimg.com/media/GYPQ_YebQAEszfF.jpg,,in,"Kota Surabaya, Jawa Timur",0,1,0,https://x.com/dprdprovjatim/status/1838542872087532007,1483288158272126979,dprdprovjatim,negatif,62.32%,negatif,49.23%
1838541215979143477,Tue Sep 24 11:29:18 +0000 2024,0,KPU Jatim Tetapkan Nomor Urut Pasangan Cagub-Cawagub di Pilkada Serentak 2024 https://t.co/5aRgJNetfN,1838541215979143477,,,in,,0,0,0,https://x.com/ibenewsid/status/1838541215979143477,1499977907074383874,ibenewsid,negatif,52.88%,positif,48.02%
1838535851497918804,Tue Sep 24 11:07:59 +0000 2024,0,Kapolda Jatim Siapkan Walpri Pengamanan Paslon Pilkada Jatim 2024 https://t.co/T6MqJDGMLJ,1838535851497918804,,,in,"Kota Bengkulu, Bengkulu",0,0,0,https://x.com/klikwarta_com/status/1838535851497918804,823779030767833088,klikwarta_com,negatif,58.79%,negatif,44.25%
1838533599877792245,Tue Sep 24 10:59:03 +0000 2024,0,KPU Jatim Tetapkan Nomor Urut Paslon Peserta Pilkada 2024 https://t.co/XuOS23RmJI #kpu #kpujatim #kpumelayani #gubernur #calongubernur2024 #gubernurjatim #pilkadaserentak2024 #gubernurjatim #pilgubjatim2024 #pilgubjatim #metaranews https://t.co/hJRrFI7tS4,1838533599877792245,https://pbs.twimg.com/media/GYPIe4gakAAsP7Q.jpg,,in,"Jawa Timur, Indonesia",0,0,0,https://x.com/MetaraNews/status/1838533599877792245,1493682253242589185,MetaraNews,positif,55.76%,positif,47.79%
1838531231333650663,Tue Sep 24 10:49:38 +0000 2024,0,Nomor urut Pilgub 2024 sudah diundi Senin (23/9). Provinsi Jakarta Jabar Jateng dan Jatim jadi yang paling jadi sorotan untuk Pilkada 2024 di Pulau Jawa. #JakartaMenyala #Pilkada2024 #Pilkada2024AmanDamai #viralvideo https://t.co/WeStw687pt,1838531231333650663,,,in,Jakarta,0,0,0,https://x.com/holopiscom/status/1838531231333650663,1366400664960573441,holopiscom,positif,52.61%,positif,48.81%
1838530064587329946,Tue Sep 24 10:45:00 +0000 2024,0,Pilkada Trenggalek 2024 Tidak Ada Perlakuan Khusus Bumbung Kosong. Masyarakat atau pemilih diberi kebebasan untuk memilih atau tidak memilih calon tunggal yang ada. https://t.co/WfKU5BQVqV,1838530064587329946,,,in,Jl Opak 1 Surabaya,0,0,0,https://x.com/BisniscomJatim/status/1838530064587329946,333877701,BisniscomJatim,negatif,56.80%,positif,36.36%
1838526289965388127,Tue Sep 24 10:30:00 +0000 2024,0,Pilkada 2024 Polda Jatim Tugaskan 113 Personel Jadi Pengawal Pribadi. Mereka bertugas mulai dari 25 September hingga 23 November 2024 untuk mengamankan dan mendukung kelancaran pelaksanaan Pilkada Serentak 2024. https://t.co/uBaFFLTolR,1838526289965388127,,,in,Jl Opak 1 Surabaya,0,0,0,https://x.com/BisniscomJatim/status/1838526289965388127,333877701,BisniscomJatim,positif,54.65%,positif,53.53%
1838523712687215059,Tue Sep 24 10:19:45 +0000 2024,1,Khofifah dan Emil melakukan pidato pada deklarasi kampanye damai jelang Pilkada Gubernur Jawa Timur 2024. Pasangan Khofifah - Emil menyampaikan bahwa persatuan kesatuan dan persaudaraan adalah nomor satu. #khofifah #emil #jawatimur #jatim #gubernur #PilkadaSerentak2024 https://t.co/TMBZ5I3HUo,1838523712687215059,https://pbs.twimg.com/ext_tw_video_thumb/1838522837587628032/pu/img/6pD7TSVI8dm1Ek8I.jpg,,in,,0,0,0,https://x.com/Metro_TV/status/1838523712687215059,57261519,Metro_TV,positif,61.35%,positif,47.20%
1838518740461486443,Tue Sep 24 10:00:00 +0000 2024,0,Pilkada 2024 Pemilih di Jatim 31.280.418 Orang. Jumlah pemilih baru dalam DPT Pilkada Jatim 2024 tersebut sebanyak 73.001 orang sedangkan jumlah pemilih tidak memenuhi syarat (tms) sebanyak 128.527 orang. https://t.co/JQTaAkW7ZR,1838518740461486443,,,in,Jl Opak 1 Surabaya,0,0,0,https://x.com/BisniscomJatim/status/1838518740461486443,333877701,BisniscomJatim,negatif,70.03%,negatif,49.93%
1838512286132244674,Tue Sep 24 09:34:21 +0000 2024,0,Elektabilitas Khofifah vs Risma vs Luluk di Hasil Survei Terbaru Pilkada Jatim 2024 #TribunKaltim #PilkadaJatim #Pilkada2024 https://t.co/y7KO8rNGFz lewat @tribunnews,1838512286132244674,,,in,"Balikpapan, Indonesia",0,0,0,https://x.com/tribunkaltim/status/1838512286132244674,103551225,tribunkaltim,positif,55.10%,positif,52.33%
1838510448465031447,Tue Sep 24 09:27:03 +0000 2024,0,Jelang Kampanye Pilkada Kasat Intelkam Polres Gresik Diganti. Gresik (https://t.co/ksziGGp1k3) Polres Gresik melakukan rotasi jabatan penting menjelang kampanye pilkada serentak 2024. https://t.co/3nk5F3yoS5 #HukumKriminal #Gresik #Jatim #PolresGresik via @beritajatimcom,1838510448465031447,,,in,Surabaya,0,0,0,https://x.com/beritajatimcom/status/1838510448465031447,21287066,beritajatimcom,positif,76.86%,positif,73.00%
1838508249215308281,Tue Sep 24 09:18:19 +0000 2024,0,Pj. Gubernur Jatim ajak peserta Pilkada 2024 hindari ujaran kebencian https://t.co/Od0LcKutX9,1838508249215308281,,,in,Indonesia,0,0,0,https://x.com/indonews_xyz/status/1838508249215308281,1763711636010045440,indonews_xyz,negatif,54.24%,negatif,37.54%
1838504264806858824,Tue Sep 24 09:02:29 +0000 2024,0,Penjabat (Pj) Gubernur Jawa Timur Adhy Karyono mengajak seluruh kontestan Pemilihan kepala Daerah (Pilkada) untuk menghindari ujaran kebencian dan hoaks selama masa tahapan kampanye pada 25 September hingga 23 November 2024. https://t.co/HhOTPtB9Nm,1838504264806858824,,,in,Jawa Timur,0,0,0,https://x.com/ANTARAJatim_/status/1838504264806858824,1557190679553769473,ANTARAJatim_,positif,58.30%,positif,46.90%
1838504156069532023,Tue Sep 24 09:02:03 +0000 2024,0,Kepolisian Resor (Polres) Batu mengerahkan 12 personel untuk bertugas sebagai pengawal pribadi (walpri) bagi tiga pasangan calon wali kota dan wakil wali kota setempat selama berlangsungnya tahapan Pemilihan Kepala Daerah (Pilkada) 2024. https://t.co/EKSfBOxixW,1838504156069532023,,,in,Jawa Timur,0,0,0,https://x.com/ANTARAJatim_/status/1838504156069532023,1557190679553769473,ANTARAJatim_,negatif,62.24%,netral,46.30%
1838503712383472099,Tue Sep 24 09:00:17 +0000 2024,0,Komisi Pemilihan Umum (KPU) Kota Malang menyiapkan enam tempat pemungutan suara (TPS) di dua lokasi khusus (loksus) yang telah disiapkan saat pelaksanaan tahapan pemungutan suara Pilkada 2024. https://t.co/FFxvRjT9AX,1838503712383472099,,,in,Jawa Timur,0,0,0,https://x.com/ANTARAJatim_/status/1838503712383472099,1557190679553769473,ANTARAJatim_,negatif,83.86%,negatif,56.49%
1838501631513760007,Tue Sep 24 08:52:01 +0000 2024,0,Komisi Pemilihan Umum Kabupaten Tulungagung Jawa Timur segera sosialisasikan detail aturan kampanye kepada empat pasangan calon yang telah ditetapkan sebagai peserta Pilkada Tulungagung 2024. https://t.co/xVrLx7nYhZ,1838501631513760007,,,in,Jawa Timur,0,0,0,https://x.com/ANTARAJatim_/status/1838501631513760007,1557190679553769473,ANTARAJatim_,positif,69.32%,positif,60.80%
1838394311588876502,Tue Sep 24 01:45:34 +0000 2024,0,Komisi Pemilihan Umum (KPU) Kabupaten Jember melakukan pengundian hingga menetapkan nomor urut pasangan calon bupati dan wakil calon bupati peserta Pilkada Jember tahun 2024 dalam rapat pleno terbuka yang digelar di Auditorium Universitas dr Soebandi https://t.co/9Ozqa2QNVC,1838394311588876502,,,in,Jawa Timur,0,0,0,https://x.com/ANTARAJatim_/status/1838394311588876502,1557190679553769473,ANTARAJatim_,positif,66.66%,netral,44.40%
1838375113294778550,Tue Sep 24 00:29:17 +0000 2024,0,Polresta Banyuwangi Siagakan Ratusan Personel Pengamanan Penetapan Nomor Urut Paslon Pilkada 2024 https://t.co/AQMpMaGSfN via @liputanwartajatim.com,1838375113294778550,,,in,,0,0,0,https://x.com/LiputanWarJatim/status/1838375113294778550,1732316440810717185,LiputanWarJatim,positif,54.50%,positif,46.86%
1838319689803636961,Mon Sep 23 20:49:03 +0000 2024,0,Ini Nomer Urut Tiga Paslon di Pilkada 2024 Magetan https://t.co/xNEQStXKiP,1838319689803636961,,,in,"Jawa Timur, Indonesia",0,0,1,https://x.com/IDNTimesJatim/status/1838319689803636961,1318893514336264193,IDNTimesJatim,negatif,49.61%,netral,42.90%
1838234319548301446,Mon Sep 23 15:12:13 +0000 2024,0,Ketua KPU Jatim Aang Kunaifi menekankan pentingnya setiap tahapan Pilkada serentak 2024 termasuk pengundian dan penetapan nomor urut. https://t.co/iQMKiUSnQq,1838234926808014945,https://pbs.twimg.com/media/GYK46vtasAEHuq9.jpg,KPU_JATIM,in,"Kota Surabaya, Jawa Timur",0,1,0,https://x.com/KPU_JATIM/status/1838234926808014945,714645219522678784,KPU_JATIM,positif,76.07%,positif,57.19%
1838221059067433444,Mon Sep 23 14:17:07 +0000 2024,0,Tiga pasangan calon dalam Pemilihan Gubernur (Pilgub) Jawa Timur 2024 telah resmi mendapatkan nomor urut dalam pengundian yang digelar oleh Komisi Pemilihan Umum Jawa Timur. Baca selengkapnya di: https://t.co/pjLurbGGli #kpu #pilkada #pilkada2024 #jawatimur #jatim #oktana https://t.co/40imY351on,1838221059067433444,https://pbs.twimg.com/media/GYKsT5pbYAAf2_Y.jpg,,in,Kediri,0,0,0,https://x.com/oktanamedia/status/1838221059067433444,1750171947911319552,oktanamedia,positif,78.80%,positif,60.02%
1838218582368636973,Mon Sep 23 14:07:17 +0000 2024,0,Ipong dan Sugiri Beda Pandangan Soal Nomor Urut Pilkada Ponorogo 2024. Tahapan pengundian nomor urut pasangan calon (Paslon) bupati dan wakil bupati dalam Pemilihan Kepala Daerah (Pilkada) https://t.co/jUsKvbyKAG #PolitikPemerintahan #Jatim #Ponorogo via @beritajatimcom,1838218582368636973,,,in,Surabaya,0,0,0,https://x.com/beritajatimcom/status/1838218582368636973,21287066,beritajatimcom,negatif,60.02%,negatif,48.74%
1838210968901607609,Mon Sep 23 13:37:01 +0000 2024,0,Pilkada Mojokerto 2024: Gus Barra Nomor Urut 2 Ikfina Nomor Urut 1 - https://t.co/BIYwrMMXpX https://t.co/osrawSNQMq,1838210968901607609,https://pbs.twimg.com/media/GYKjIlIaoAAU26_.jpg,,in,Malang,0,0,0,https://x.com/tugujatim/status/1838210968901607609,1299135979010142208,tugujatim,negatif,58.72%,negatif,40.46%
1838196366134444049,Mon Sep 23 12:39:00 +0000 2024,0,Terbaru Survei Pilkada Jatim 2024 Nomor Urut Paslon Luluk-Lukman Khofifah-Emil dan Risma-Gus Hans https://t.co/TrbtSPVfOr lewat @tribunkaltim,1838196366134444049,,,in,"Balikpapan, Indonesia",0,0,0,https://x.com/tribunkaltim/status/1838196366134444049,103551225,tribunkaltim,negatif,60.33%,negatif,42.86%
1838184679905653239,Mon Sep 23 11:52:34 +0000 2024,0,KPU Sumenep Tetapkan Nomor Urut Paslon Pilkada 2024: Fikri-Unais 1 Fauzi-Imam 2 #mediajatim #lebihtahujawatimur #kpusumenep #rapatpleno #nomorundian #paslonbupati #pilkadasumenep2024 #infosumenep #lfl https://t.co/I5LxcnsPwf,1838184679905653239,,,in,"Pamekasan, Jawa Timur",0,0,0,https://x.com/MediaJatim/status/1838184679905653239,846324454003171328,MediaJatim,positif,48.83%,positif,44.28%
1838177040694190301,Mon Sep 23 11:22:12 +0000 2024,0,Hasil Survei Pilkada Jatim 2024 Persaingan Elektabilitas-Popularitas Khofifah vs Risma Luluk? https://t.co/3KgWIx5kd8 lewat @tribunnews,1838177040694190301,,,in,,0,0,0,https://x.com/KerenDarmono/status/1838177040694190301,1838175226980655104,KerenDarmono,positif,52.66%,positif,49.51%
1838173927560155244,Mon Sep 23 11:09:50 +0000 2024,1,#TemanPemilih berikut hasil Rekapitulasi Daftar Pemilih Tetap (DPT) untuk Kecamatan Tenggarang pada Pilkada Serentak Tahun 2024. @kpu_ri @kpu_jatim @kpubondowoso #kpumelayani #kpubondowoso #pilkadaserentak2024 #rengsarengkaponglompong https://t.co/VVj9YZKxqw,1838173927560155244,https://pbs.twimg.com/media/GYKBXtLaMAEc-WL.jpg,,in,Kecamatan Tenggarang,0,0,0,https://x.com/ppk_tgr/status/1838173927560155244,1635319151026921473,ppk_tgr,negatif,59.14%,positif,55.25%
1838150771839496688,Mon Sep 23 09:37:49 +0000 2024,0,Terbaru Survei Pilkada Jatim 2024 Nomor Urut Paslon Luluk-Lukman Khofifah-Emil dan Risma-Gus Hans https://t.co/TrbtSPVfOr lewat @tribunkaltim,1838150771839496688,,,in,"Balikpapan, Indonesia",0,0,0,https://x.com/tribunkaltim/status/1838150771839496688,103551225,tribunkaltim,negatif,60.33%,negatif,42.86%
1838147058571911461,Mon Sep 23 09:23:04 +0000 2024,0,Mak Rini Dapat Nomor Urut 2 Pilkada Blitar: Isyarat 2 Periode. Calon petahana Rini Syarifah-Abdul Ghoni resmi mendapatkan nomor urut 2 di Pemilihan Bupati Blitar 2024. Rini Syarifah pun https://t.co/d0C22z2Gxk #PolitikPemerintahan #Blitar #Jatim #MakRini via @beritajatimcom,1838147058571911461,,,in,Surabaya,0,0,0,https://x.com/beritajatimcom/status/1838147058571911461,21287066,beritajatimcom,negatif,68.38%,negatif,47.83%
1838143720568619108,Mon Sep 23 09:09:48 +0000 2024,0,Partai Ummat Merapat ke PDIP Dukung Petahana di Pilkada Jember 2024 - https://t.co/A3WKbwqCNJ https://t.co/icOdWkFFaT,1838143720568619108,https://pbs.twimg.com/media/GYJl-QSbEAApgUU.jpg,,in,Malang,0,0,0,https://x.com/tugujatim/status/1838143720568619108,1299135979010142208,tugujatim,negatif,61.14%,positif,42.91%
1838139633689129312,Mon Sep 23 08:53:34 +0000 2024,0,KPUD Jatim melakukan pengundian nomor urut untuk Pilkada Jatim pada 2024 di Hotel Mercure Mirama Surabaya Senin (23/9/2024) siang. https://t.co/juBkSeNI3f,1838139633689129312,,,in,"Jakarta, Indonesia",0,0,0,https://x.com/nawabinekanews/status/1838139633689129312,1762043186598604800,nawabinekanews,negatif,47.48%,positif,36.69%
1838134869521498214,Mon Sep 23 08:34:38 +0000 2024,0,Partai Demokrat Gresik Gelar Konsolidasi Menuju Kemenangan Pilgub Jatim dan Pilkada Gresik 2024 https://t.co/Wuxhxpbnj5,1838134869521498214,,,in,,0,0,0,https://x.com/PontiDaily/status/1838134869521498214,1710150884292997120,PontiDaily,positif,77.66%,positif,67.58%
1838130214179868797,Mon Sep 23 08:16:08 +0000 2024,0,Masuk Masa Kampanye Pilkada Ngawi 2024 Ony-Antok Cuti 2 Bulan. Ngawi (https://t.co/ksziGGp1k3) Memasuki masa kampanye Pilkada Ngawi 2024 paslon petahana Ony Anwar Harsono-Dwi Rianto https://t.co/qj2D2h4O1M #PolitikPemerintahan #Jatim #Ngawi #OnyAntok via @beritajatimcom,1838130214179868797,,,in,Surabaya,0,0,0,https://x.com/beritajatimcom/status/1838130214179868797,21287066,beritajatimcom,negatif,78.05%,negatif,47.84%
1838123753173291281,Mon Sep 23 08:08:02 +0000 2024,0,Penantang Khofifah pada Pilkada Jatim 2024 akan berhadapan dengan unsur ketokohan yang kuat dan mesin koalisi KIM plus. #Pilkada2024 #Riset #AdadiKompas https://t.co/IMPxL8LQN2,1838128176494793064,,KompasData,in,"Palmerah, Jakarta",0,1,0,https://x.com/KompasData/status/1838128176494793064,771030588,KompasData,negatif,72.26%,negatif,44.94%
1838125850677416259,Mon Sep 23 07:58:48 +0000 2024,0,Partai Demokrat Gresik Gelar Konsolidasi Menuju Kemenangan Pilgub Jatim dan Pilkada Gresik 2024 https://t.co/f3oXZkYDYn,1838125850677416259,,,in,,0,0,0,https://x.com/MimbarAndalas_/status/1838125850677416259,1613814837985050624,MimbarAndalas_,positif,77.66%,positif,67.58%
1838124382725521737,Mon Sep 23 07:52:58 +0000 2024,0,Breaking News : Berikut adalah nomor urut untuk pasangan Cagub dan Cawagub Jawa Timur 2024. Nomor Urut Pilkada Jatim : Luluk-Lukman 1 Khofifah-Emil 2 dan Risma-Gus Hans 3 https://t.co/94mjrQ4L16,1838124382725521737,,,in,Jakarta,0,0,0,https://x.com/holopiscom/status/1838124382725521737,1366400664960573441,holopiscom,negatif,48.56%,netral,35.31%
1838123652027498539,Mon Sep 23 07:50:03 +0000 2024,0,Komisi Pemilihan Umum (KPU) Kabupaten Bondowoso Jawa Timur Senin menjadwalkan tahapan pengundian nomor urut pasangan calon bupati dan calon wakil bupati setelah sebelumnya telah ditetapkan dua pasangan calon peserta Pilkada 2024 . https://t.co/VBtoeLxYgr,1838123652027498539,,,in,Jawa Timur,0,0,0,https://x.com/ANTARAJatim_/status/1838123652027498539,1557190679553769473,ANTARAJatim_,positif,67.16%,positif,48.36%
1837829072757706788,Mon Sep 23 07:27:04 +0000 2024,1,@Dyananjani89 Semoga pilkada jateng 2024 menjadi kuburan massal gerombolan banteng. dan jatim dan jabar. dan dki. bali juga.,1838117865234563438,,Dyananjani89,in,Location unknown,0,1,0,https://x.com/cukSJWcuk/status/1838117865234563438,1464155853884465154,cukSJWcuk,negatif,71.65%,negatif,51.27%
1838112957491998921,Mon Sep 23 07:07:34 +0000 2024,0,Pilkada Tuban 2024: Riyadi-Wafi Nomor Urut 1 Lindra-Joko 2. Rapat pleno terbuka pengundian dan penetapan nomor urut pasangan Calon Bupati dan Wakil Bupati Tuban digelar KPU pada Senin https://t.co/3SMVgR0esU #PolitikPemerintahan #Jatim #kputuban via @beritajatimcom,1838112957491998921,,,in,Surabaya,0,0,0,https://x.com/beritajatimcom/status/1838112957491998921,21287066,beritajatimcom,negatif,54.22%,negatif,39.25%
1838104949525266505,Mon Sep 23 06:35:44 +0000 2024,0,Partai Demokrat Gresik Gelar Konsolidasi Menuju Kemenangan Pilgub Jatim dan Pilkada Gresik 2024 https://t.co/bZlz41KDX2,1838104949525266505,,,in,,0,0,0,https://x.com/TajukNasional/status/1838104949525266505,729309555486642176,TajukNasional,positif,77.66%,positif,67.58%
1838099865718419515,Mon Sep 23 06:15:32 +0000 2024,0,Pasangan calon (paslon) Pemilihan Kepala Daerah (Pilkada) Lamongan nomor urut 2 Yuhronur Efendi yang berpasangan dengan Dirham Akbar Aksara mulai fokus mempersiapkan diri untuk pelaksanaan masa kampanye yang akan dimulai pada 25 September 2024. https://t.co/rZvR5stvR1,1838099865718419515,,,in,Jawa Timur,0,0,0,https://x.com/ANTARAJatim_/status/1838099865718419515,1557190679553769473,ANTARAJatim_,positif,64.61%,positif,43.59%
1838092103823262038,Mon Sep 23 05:44:42 +0000 2024,0,testimoni Habib M Rohan Anggota KPU Jawa Timur menjelang Pilkada tahun 2024 @divisihumaspolri #pilkada2024 #jawatimur #humaspolri #humaspoldajatim #Kapoldajatim #poldajatim #Multimedia #polri #presisi #jatimbangkitterusmelaju https://t.co/uCtkX86daV,1838092103823262038,https://pbs.twimg.com/ext_tw_video_thumb/1838091989482688512/pu/img/DxsaHvA-IaYCerh1.jpg,,in,,0,0,0,https://x.com/bidhumas_jatim/status/1838092103823262038,1444824442954137603,bidhumas_jatim,positif,61.47%,positif,50.25%
1838089276711714853,Mon Sep 23 05:33:28 +0000 2024,0,Hasil Undian Nomor Urut Paslon Pilkada Malang 2024: Sanusi-Lathifah 1 Gunawan-Umar 2 - https://t.co/zR8OySpv0F https://t.co/JcFzRQA5j7,1838089276711714853,https://pbs.twimg.com/media/GYI0dJDaQAAbIcs.jpg,,in,Malang,0,0,0,https://x.com/tugujatim/status/1838089276711714853,1299135979010142208,tugujatim,negatif,63.07%,negatif,42.86%
1838081828651176103,Mon Sep 23 05:03:52 +0000 2024,0,Komisi Pemilihan Umum (KPU) Kabupaten Lamongan menuntaskan tahapan penetapan dan pengundian nomor urut pasangan calon bupati dan wakil bupati untuk Pemilihan Kepala Daerah (Pilkada) 2024 di Sport Center Lamongan Jawa Timur Senin. https://t.co/5OM3M2i06w,1838081828651176103,,,in,Jawa Timur,0,0,0,https://x.com/ANTARAJatim_/status/1838081828651176103,1557190679553769473,ANTARAJatim_,positif,76.79%,positif,48.45%
1838068818494750808,Mon Sep 23 04:12:10 +0000 2024,0,Pengamanan Ketat Pengundian Nomor Urut Paslon Pilkada Ponorogo 2024. Menjelang pengundian nomor urut paslon Pilkada Ponorogo 2024 Polres Ponorogo bersama instansi terkait menyiapkan https://t.co/cmr5jdAf7c #Peristiwa #Jatim #pilkadaponorogo #Ponorogo via @beritajatimcom,1838068818494750808,,,in,Surabaya,0,0,0,https://x.com/beritajatimcom/status/1838068818494750808,21287066,beritajatimcom,negatif,70.45%,negatif,55.84%
1838059467293814798,Mon Sep 23 03:36:58 +0000 2024,0,Ia berharap kegiatan yang digelar dapat menggugah kesadaran masyarakat akan pentingnya partisipasi aktif dalam Pilkada serentak 2024.,1838059959474635059,,KPU_JATIM,in,"Kota Surabaya, Jawa Timur",0,1,0,https://x.com/KPU_JATIM/status/1838059959474635059,714645219522678784,KPU_JATIM,positif,66.59%,positif,63.28%
1838058130858709253,Mon Sep 23 03:30:29 +0000 2024,0,Ketua KPU Jatim Aang Kunaifi menjelaskan awal mula terbentuknya Satgas Demokrasi. Bermula ketika organisasi mahasiswa yang tergabung dalam Cipayung Plus memberikan gagasan kepada KPU Jatim agar pada Pilkada serentak 2024 mereka tidak hanya menjadi pemilih https://t.co/jSCgabUnKj,1838058328930550244,https://pbs.twimg.com/media/GYIYThJaAAAaefz.jpg,KPU_JATIM,in,"Kota Surabaya, Jawa Timur",0,1,0,https://x.com/KPU_JATIM/status/1838058328930550244,714645219522678784,KPU_JATIM,positif,71.30%,positif,60.64%
1838057435895935485,Mon Sep 23 03:28:33 +0000 2024,1,Aang juga mengajak masyarakat untuk berpartisipasi baik secara daring maupun luring agar semakin peduli terhadap Pilkada serentak 2024 yang menjadi bagian dari amanah reformasi.,1838057840931688489,,KPU_JATIM,in,"Kota Surabaya, Jawa Timur",0,1,1,https://x.com/KPU_JATIM/status/1838057840931688489,714645219522678784,KPU_JATIM,positif,66.03%,positif,61.96%
1838057435895935485,Mon Sep 23 03:28:19 +0000 2024,0,Dukungan dan kritik dari masyarakat diakuinya sangat penting bagi KPU Jatim sebagai penyelenggara Pilkada serentak 2024.,1838057781703954790,,KPU_JATIM,in,"Kota Surabaya, Jawa Timur",0,1,0,https://x.com/KPU_JATIM/status/1838057781703954790,714645219522678784,KPU_JATIM,positif,55.52%,positif,55.67%
1838057435895935485,Mon Sep 23 03:26:56 +0000 2024,6,#TemanPemilih Komisi Pemilihan Umum Provinsi Jawa Timur (KPU Jatim) menggelar Jambore Satgas Demokrasi Jawa Timur dengan tema 'Meneguhkan Peran Intelektual Muda yang Berkarakter dan Berperadaban Unggul dalam Mewujudkan Pilkada Serentak 2024 Jatim Berintegritas. https://t.co/ZGdPYXHD8N,1838057435895935485,https://pbs.twimg.com/media/GYIXfbAb0AAzUmk.jpg,,in,"Kota Surabaya, Jawa Timur",0,1,1,https://x.com/KPU_JATIM/status/1838057435895935485,714645219522678784,KPU_JATIM,positif,80.48%,positif,62.96%
1838057005015253121,Mon Sep 23 03:25:36 +0000 2024,0,Penghargaan ini diharapkan jadi pemicu semangat bagi jajaran KPU Jatim maupun Satgas Demokrasi untuk bersama-sama menjalankan tugas dengan sebaik-baiknya dalam upaya menyukseskan Pilkada serentak 2024.,1838057098703429840,,KPU_JATIM,in,"Kota Surabaya, Jawa Timur",0,1,0,https://x.com/KPU_JATIM/status/1838057098703429840,714645219522678784,KPU_JATIM,positif,60.89%,positif,54.24%
1838055864479232162,Mon Sep 23 03:20:44 +0000 2024,0,5. Komisi Pemilihan Umum (KPU) Jawa Timur telah menetapkan pasangan calon gubernur-wakil gubernur Jawa Timur dalam Pilkada Jatim 2024. Penetapan tersebut merupakan hasil dari rapat pleno yang juga dihadiri ketiga cagub-cawagub Khofifah Indar Parawansa-Emil Elestianto Dardak Tri,1838055873878561251,,Metro_TV,in,,0,0,0,https://x.com/Metro_TV/status/1838055873878561251,57261519,Metro_TV,positif,60.20%,positif,54.66%
1838048909392027769,Mon Sep 23 02:53:03 +0000 2024,4,Mari hadir dalam diskusi X Space: Bukan Sekadar Simbol: Mengawal Keterwakilan Bermakna Tiga Perempuan di Pilkada Jatim ! ️: Rabu 25 September 2024 : 19.00 20.00 WIB : X (Twitter) @konde_co dan @kawula_17 Pilkada Jawa Timur 2024 menjadi salah satu yang paling menarik https://t.co/wz8RYnVSBv,1838048909392027769,https://pbs.twimg.com/media/GYIPu_eagAA9Hf-.jpg,,in,Indonesia,1,1,3,https://x.com/konde_co/status/1838048909392027769,1269826533096448001,konde_co,positif,50.90%,positif,43.23%
1838009123142881388,Mon Sep 23 00:14:58 +0000 2024,0,Bawaslu Ingatkan Dua Paslon Pilkada Tuban 2024 Tidak Curi Start Kampanye - https://t.co/bnpaZneNb1 https://t.co/f7ONcg5zcS,1838009123142881388,https://pbs.twimg.com/media/GYHrjnNbgAAGanx.jpg,,in,Malang,0,0,0,https://x.com/tugujatim/status/1838009123142881388,1299135979010142208,tugujatim,negatif,63.81%,negatif,45.10%
1838007007384842482,Mon Sep 23 00:06:33 +0000 2024,0,KPU Kota Probolinggo Resmi Tetapkan DPT Pilkada Serentak 2024. Komisi Pemilihan Umum (KPU) Kota Probolinggo telah resmi menetapkan Daftar Pemilih Tetap (DPT) untuk Pemilihan Gubernur dan https://t.co/XEoGHZL5ZJ #PolitikPemerintahan #Jatim #Probolinggo via @beritajatimcom,1838007007384842482,,,in,Surabaya,0,0,0,https://x.com/beritajatimcom/status/1838007007384842482,21287066,beritajatimcom,positif,56.03%,positif,52.65%
1837999386103804311,Sun Sep 22 23:36:16 +0000 2024,0,Luluk Target 15 Juta Suara! Hasil Survei Pilkada Jatim 2024 Elektabilitas Lawan Khofifah dan Risma https://t.co/KQfnYLYFQB lewat @tribunnews #luluk #khofifah #risma #pilkada #jatim,1837999386103804311,,,in,"Balikpapan, Indonesia",0,0,0,https://x.com/tribunkaltim/status/1837999386103804311,103551225,tribunkaltim,negatif,59.43%,positif,38.90%
